--
-- int16_overflow.sql
--
-- Regression tests for the int16 (128-bit signed integer) extension focusing
-- on values that exceed the int64 range, overflow detection, boundary
-- conditions, and sign combinations.  These tests are designed to verify
-- correctness of both the native __int128 and the struct-based INT128
-- fallback code paths.
--
-- This file assumes the extension is already loaded (by the preceding
-- int16.sql test).
--
--
-- Constants for readability
--
-- INT64_MAX  = 9223372036854775807
-- INT64_MIN  = -9223372036854775808
-- 2^63       = 9223372036854775808
-- 2^63+1     = 9223372036854775809
-- 2^64       = 18446744073709551616
-- 2^126      = 85070591730234615865843651857942052864
-- INT16_MAX  = 170141183460469231731687303715884105727
-- INT16_MIN  = -170141183460469231731687303715884105728
-- =========================================================================
-- Addition
-- =========================================================================
SELECT '9223372036854775808'::int16 + '9223372036854775808'::int16;  -- 2^63 + 2^63 = 2^64
       ?column?       
----------------------
 18446744073709551616
(1 row)

SELECT '-9223372036854775809'::int16 + '-9223372036854775809'::int16; -- -(2^63+1) + -(2^63+1)
       ?column?        
-----------------------
 -18446744073709551618
(1 row)

SELECT '170141183460469231731687303715884105727'::int16 + '-170141183460469231731687303715884105728'::int16; -- MAX + MIN
 ?column? 
----------
 -1
(1 row)

SELECT '170141183460469231731687303715884105727'::int16 + '1'::int16; -- overflow
ERROR:  integer out of range
SELECT '-170141183460469231731687303715884105728'::int16 + '-1'::int16; -- overflow
ERROR:  integer out of range
SELECT '18446744073709551616'::int16 + '0'::int16; -- 2^64 + 0
       ?column?       
----------------------
 18446744073709551616
(1 row)

SELECT '-18446744073709551616'::int16 + '18446744073709551616'::int16; -- -2^64 + 2^64
 ?column? 
----------
 0
(1 row)

SELECT '9223372036854775807'::int16 + '9223372036854775808'::int16; -- INT64_MAX + 2^63
       ?column?       
----------------------
 18446744073709551615
(1 row)

SELECT '-9223372036854775808'::int16 + '-9223372036854775808'::int16; -- INT64_MIN + INT64_MIN
       ?column?        
-----------------------
 -18446744073709551616
(1 row)

SELECT '85070591730234615865843651857942052864'::int16 + '85070591730234615865843651857942052864'::int16; -- 2^126 + 2^126 (overflow)
ERROR:  integer out of range
-- =========================================================================
-- Subtraction
-- =========================================================================
SELECT '-9223372036854775809'::int16 - '9223372036854775808'::int16; -- -(2^63+1) - 2^63
       ?column?        
-----------------------
 -18446744073709551617
(1 row)

SELECT '9223372036854775808'::int16 - '-9223372036854775809'::int16; -- 2^63 - -(2^63+1)
       ?column?       
----------------------
 18446744073709551617
(1 row)

SELECT '170141183460469231731687303715884105727'::int16 - '-1'::int16; -- MAX - (-1) = overflow
ERROR:  integer out of range
SELECT '-170141183460469231731687303715884105728'::int16 - '1'::int16; -- MIN - 1 = overflow
ERROR:  integer out of range
SELECT '18446744073709551616'::int16 - '1'::int16; -- 2^64 - 1
       ?column?       
----------------------
 18446744073709551615
(1 row)

SELECT '0'::int16 - '-18446744073709551616'::int16; -- 0 - (-2^64)
       ?column?       
----------------------
 18446744073709551616
(1 row)

SELECT '170141183460469231731687303715884105727'::int16 - '170141183460469231731687303715884105726'::int16; -- MAX - (MAX-1)
 ?column? 
----------
 1
(1 row)

SELECT '-170141183460469231731687303715884105727'::int16 - '-170141183460469231731687303715884105728'::int16; -- -(MIN+1) - MIN
 ?column? 
----------
 1
(1 row)

SELECT '9223372036854775808'::int16 - '9223372036854775807'::int16; -- 2^63 - INT64_MAX
 ?column? 
----------
 1
(1 row)

SELECT '-9223372036854775809'::int16 - '-9223372036854775808'::int16; -- -(2^63+1) - INT64_MIN
 ?column? 
----------
 -1
(1 row)

-- =========================================================================
-- Multiplication
-- =========================================================================
SELECT '3000000000'::int16 * '3000000000'::int16;  -- 9e18 > INT64_MAX
      ?column?       
---------------------
 9000000000000000000
(1 row)

SELECT '-3000000000'::int16 * '3000000000'::int16; -- -9e18
       ?column?       
----------------------
 -9000000000000000000
(1 row)

SELECT '3000000000'::int16 * '-3000000000'::int16; -- -9e18
       ?column?       
----------------------
 -9000000000000000000
(1 row)

SELECT '-3000000000'::int16 * '-3000000000'::int16; -- 9e18
      ?column?       
---------------------
 9000000000000000000
(1 row)

SELECT '170141183460469231731687303715884105727'::int16 * '2'::int16; -- overflow
ERROR:  integer out of range
SELECT '18446744073709551616'::int16 * '18446744073709551616'::int16; -- 2^64 * 2^64 overflow
ERROR:  integer out of range
SELECT '4294967296'::int16 * '4294967296'::int16;  -- 2^32 * 2^32 = 2^64
       ?column?       
----------------------
 18446744073709551616
(1 row)

SELECT '-4294967296'::int16 * '4294967296'::int16; -- -2^64
       ?column?        
-----------------------
 -18446744073709551616
(1 row)

SELECT '9223372036854775807'::int16 * '9223372036854775807'::int16; -- INT64_MAX^2
                ?column?                
----------------------------------------
 85070591730234615847396907784232501249
(1 row)

SELECT '0'::int16 * '18446744073709551616'::int16; -- 0 * 2^64
 ?column? 
----------
 0
(1 row)

SELECT '18446744073709551616'::int16 * '1'::int16; -- 2^64 * 1
       ?column?       
----------------------
 18446744073709551616
(1 row)

SELECT '18446744073709551615'::int16 * '2'::int16; -- (2^64-1) * 2
       ?column?       
----------------------
 36893488147419103230
(1 row)

-- =========================================================================
-- Division
-- =========================================================================
SELECT '170141183460469231731687303715884105727'::int16 / '170141183460469231731687303715884105727'::int16; -- MAX / MAX = 1
 ?column? 
----------
 1
(1 row)

SELECT '170141183460469231731687303715884105727'::int16 / '-1'::int16; -- MAX / -1 = -MAX
                 ?column?                 
------------------------------------------
 -170141183460469231731687303715884105727
(1 row)

SELECT '-170141183460469231731687303715884105728'::int16 / '-1'::int16; -- MIN / -1 = overflow
ERROR:  integer out of range
SELECT '170141183460469231731687303715884105727'::int16 / '2'::int16; -- MAX / 2
                ?column?                
----------------------------------------
 85070591730234615865843651857942052863
(1 row)

SELECT '-170141183460469231731687303715884105728'::int16 / '2'::int16; -- MIN / 2
                ?column?                 
-----------------------------------------
 -85070591730234615865843651857942052864
(1 row)

SELECT '18446744073709551616'::int16 / '9223372036854775808'::int16; -- 2^64 / 2^63 = 2
 ?column? 
----------
 2
(1 row)

SELECT '-18446744073709551616'::int16 / '9223372036854775808'::int16; -- -2^64 / 2^63 = -2
 ?column? 
----------
 -2
(1 row)

SELECT '18446744073709551616'::int16 / '-9223372036854775808'::int16; -- 2^64 / -2^63 = -2
 ?column? 
----------
 -2
(1 row)

SELECT '-18446744073709551616'::int16 / '-9223372036854775808'::int16; -- -2^64 / -2^63 = 2
 ?column? 
----------
 2
(1 row)

SELECT '170141183460469231731687303715884105727'::int16 / '9223372036854775807'::int16; -- MAX / INT64_MAX
       ?column?       
----------------------
 18446744073709551618
(1 row)

SELECT '1'::int16 / '0'::int16;  -- division by zero
ERROR:  division by zero
-- =========================================================================
-- Remainder (modulo)
-- =========================================================================
SELECT '170141183460469231731687303715884105727'::int16 % '10'::int16;  -- MAX % 10
 ?column? 
----------
 7
(1 row)

SELECT '-170141183460469231731687303715884105728'::int16 % '10'::int16; -- MIN % 10
 ?column? 
----------
 -8
(1 row)

SELECT '170141183460469231731687303715884105727'::int16 % '-10'::int16;  -- MAX % -10
 ?column? 
----------
 7
(1 row)

SELECT '-170141183460469231731687303715884105728'::int16 % '-10'::int16; -- MIN % -10
 ?column? 
----------
 -8
(1 row)

SELECT '18446744073709551616'::int16 % '9223372036854775808'::int16; -- 2^64 % 2^63 = 0
 ?column? 
----------
 0
(1 row)

SELECT '18446744073709551617'::int16 % '9223372036854775808'::int16; -- (2^64+1) % 2^63 = 1
 ?column? 
----------
 1
(1 row)

SELECT '-18446744073709551617'::int16 % '9223372036854775808'::int16; -- -(2^64+1) % 2^63 = -1
 ?column? 
----------
 -1
(1 row)

SELECT '18446744073709551617'::int16 % '-9223372036854775808'::int16; -- (2^64+1) % -2^63 = 1
 ?column? 
----------
 1
(1 row)

SELECT '-18446744073709551617'::int16 % '-9223372036854775808'::int16; -- -(2^64+1) % -2^63 = -1
 ?column? 
----------
 -1
(1 row)

SELECT '1'::int16 % '0'::int16;  -- division by zero
ERROR:  division by zero
-- =========================================================================
-- Unary minus
-- =========================================================================
SELECT -'170141183460469231731687303715884105727'::int16;  -- -MAX
                 ?column?                 
------------------------------------------
 -170141183460469231731687303715884105727
(1 row)

SELECT -'-170141183460469231731687303715884105728'::int16; -- -MIN = overflow
ERROR:  integer out of range
SELECT -'9223372036854775808'::int16;  -- -2^63
       ?column?       
----------------------
 -9223372036854775808
(1 row)

SELECT -'-9223372036854775808'::int16; -- 2^63
      ?column?       
---------------------
 9223372036854775808
(1 row)

SELECT -'18446744073709551616'::int16; -- -2^64
       ?column?        
-----------------------
 -18446744073709551616
(1 row)

-- =========================================================================
-- Bitwise AND
-- =========================================================================
SELECT '18446744073709551616'::int16 & '18446744073709551616'::int16; -- 2^64 & 2^64
       ?column?       
----------------------
 18446744073709551616
(1 row)

SELECT '18446744073709551616'::int16 & '1'::int16; -- 2^64 & 1 = 0
 ?column? 
----------
 0
(1 row)

SELECT '18446744073709551617'::int16 & '1'::int16; -- 2^64+1 & 1 = 1
 ?column? 
----------
 1
(1 row)

SELECT '-1'::int16 & '18446744073709551616'::int16; -- -1 & 2^64 = 2^64
       ?column?       
----------------------
 18446744073709551616
(1 row)

SELECT '-1'::int16 & '0'::int16; -- -1 & 0 = 0
 ?column? 
----------
 0
(1 row)

SELECT '170141183460469231731687303715884105727'::int16 & '0'::int16; -- MAX & 0
 ?column? 
----------
 0
(1 row)

SELECT '-170141183460469231731687303715884105728'::int16 & '0'::int16; -- MIN & 0
 ?column? 
----------
 0
(1 row)

-- =========================================================================
-- Bitwise OR
-- =========================================================================
SELECT '18446744073709551616'::int16 | '1'::int16; -- 2^64 | 1 = 2^64+1
       ?column?       
----------------------
 18446744073709551617
(1 row)

SELECT '18446744073709551616'::int16 | '0'::int16; -- 2^64 | 0 = 2^64
       ?column?       
----------------------
 18446744073709551616
(1 row)

SELECT '0'::int16 | '18446744073709551616'::int16; -- 0 | 2^64 = 2^64
       ?column?       
----------------------
 18446744073709551616
(1 row)

SELECT '-1'::int16 | '0'::int16; -- -1 | 0 = -1
 ?column? 
----------
 -1
(1 row)

SELECT '18446744073709551615'::int16 | '1'::int16; -- (2^64-1) | 1 = 2^64-1
       ?column?       
----------------------
 18446744073709551615
(1 row)

-- =========================================================================
-- Bitwise XOR
-- =========================================================================
SELECT '18446744073709551616'::int16 # '1'::int16; -- 2^64 # 1 = 2^64+1
       ?column?       
----------------------
 18446744073709551617
(1 row)

SELECT '18446744073709551616'::int16 # '18446744073709551616'::int16; -- 2^64 # 2^64 = 0
 ?column? 
----------
 0
(1 row)

SELECT '0'::int16 # '18446744073709551616'::int16; -- 0 # 2^64 = 2^64
       ?column?       
----------------------
 18446744073709551616
(1 row)

SELECT '-1'::int16 # '0'::int16; -- -1 # 0 = -1
 ?column? 
----------
 -1
(1 row)

SELECT '-1'::int16 # '18446744073709551616'::int16; -- -1 # 2^64 = -(2^64+1)
       ?column?        
-----------------------
 -18446744073709551617
(1 row)

SELECT '-1'::int16 # '-1'::int16; -- -1 # -1 = 0
 ?column? 
----------
 0
(1 row)

-- =========================================================================
-- Bitwise NOT
-- =========================================================================
SELECT ~'0'::int16; -- ~0 = -1
 ?column? 
----------
 -1
(1 row)

SELECT ~'-1'::int16; -- ~(-1) = 0
 ?column? 
----------
 0
(1 row)

SELECT ~'18446744073709551616'::int16; -- ~(2^64)
       ?column?        
-----------------------
 -18446744073709551617
(1 row)

SELECT ~'170141183460469231731687303715884105727'::int16; -- ~MAX = MIN
                 ?column?                 
------------------------------------------
 -170141183460469231731687303715884105728
(1 row)

SELECT ~'-170141183460469231731687303715884105728'::int16; -- ~MIN = MAX
                ?column?                 
-----------------------------------------
 170141183460469231731687303715884105727
(1 row)

-- =========================================================================
-- Left shift (shifts 0-127 only; behavior matches int8: raw C shift)
-- =========================================================================
SELECT '1'::int16 << 0;   -- 1
 ?column? 
----------
 1
(1 row)

SELECT '1'::int16 << 1;   -- 2
 ?column? 
----------
 2
(1 row)

SELECT '1'::int16 << 64;  -- 2^64
       ?column?       
----------------------
 18446744073709551616
(1 row)

SELECT '1'::int16 << 127; -- 2^127 = INT16_MIN
                 ?column?                 
------------------------------------------
 -170141183460469231731687303715884105728
(1 row)

SELECT '18446744073709551616'::int16 << 1;  -- 2^64 << 1 = 2^65
       ?column?       
----------------------
 36893488147419103232
(1 row)

SELECT '18446744073709551616'::int16 << 63; -- 2^64 << 63 = 2^127 = INT16_MIN
                 ?column?                 
------------------------------------------
 -170141183460469231731687303715884105728
(1 row)

SELECT '-1'::int16 << 1;  -- -1 << 1 = -2
 ?column? 
----------
 -2
(1 row)

SELECT '-1'::int16 << 0;  -- -1 << 0 = -1
 ?column? 
----------
 -1
(1 row)

-- =========================================================================
-- Right shift (shifts 0-127 only; arithmetic shift for negative values)
-- =========================================================================
SELECT '-1'::int16 >> 1;  -- -1 >> 1 = -1 (arithmetic)
 ?column? 
----------
 -1
(1 row)

SELECT '-1'::int16 >> 64; -- -1 >> 64 = -1 (arithmetic)
 ?column? 
----------
 -1
(1 row)

SELECT '18446744073709551616'::int16 >> 1;  -- 2^64 >> 1 = 2^63
      ?column?       
---------------------
 9223372036854775808
(1 row)

SELECT '18446744073709551616'::int16 >> 64; -- 2^64 >> 64 = 1
 ?column? 
----------
 1
(1 row)

SELECT '18446744073709551616'::int16 >> 0;  -- 2^64 >> 0 = 2^64
       ?column?       
----------------------
 18446744073709551616
(1 row)

SELECT '170141183460469231731687303715884105727'::int16 >> 1; -- MAX >> 1
                ?column?                
----------------------------------------
 85070591730234615865843651857942052863
(1 row)

SELECT '-170141183460469231731687303715884105728'::int16 >> 1; -- MIN >> 1
                ?column?                 
-----------------------------------------
 -85070591730234615865843651857942052864
(1 row)

SELECT '-170141183460469231731687303715884105728'::int16 >> 64; -- MIN >> 64
       ?column?       
----------------------
 -9223372036854775808
(1 row)

SELECT '0'::int16 >> 10; -- 0 >> 10 = 0
 ?column? 
----------
 0
(1 row)

-- =========================================================================
-- Cross-type arithmetic (minimal: one test per operator per type)
-- =========================================================================
-- int16 op int8
SELECT '18446744073709551616'::int16 + '1'::int8;
       ?column?       
----------------------
 18446744073709551617
(1 row)

SELECT '1'::int8 + '18446744073709551616'::int16;
       ?column?       
----------------------
 18446744073709551617
(1 row)

SELECT '18446744073709551616'::int16 - '1'::int8;
       ?column?       
----------------------
 18446744073709551615
(1 row)

SELECT '1'::int8 - '18446744073709551616'::int16;
       ?column?        
-----------------------
 -18446744073709551615
(1 row)

SELECT '18446744073709551616'::int16 * '2'::int8;
       ?column?       
----------------------
 36893488147419103232
(1 row)

SELECT '2'::int8 * '18446744073709551616'::int16;
       ?column?       
----------------------
 36893488147419103232
(1 row)

SELECT '18446744073709551616'::int16 / '2'::int8;
      ?column?       
---------------------
 9223372036854775808
(1 row)

SELECT '2'::int8 / '18446744073709551616'::int16;
 ?column? 
----------
 0
(1 row)

-- int16 op int4
SELECT '18446744073709551616'::int16 + 1;
       ?column?       
----------------------
 18446744073709551617
(1 row)

SELECT 1 + '18446744073709551616'::int16;
       ?column?       
----------------------
 18446744073709551617
(1 row)

SELECT '18446744073709551616'::int16 - 1;
       ?column?       
----------------------
 18446744073709551615
(1 row)

SELECT 1 - '18446744073709551616'::int16;
       ?column?        
-----------------------
 -18446744073709551615
(1 row)

SELECT '18446744073709551616'::int16 * 2;
       ?column?       
----------------------
 36893488147419103232
(1 row)

SELECT 2 * '18446744073709551616'::int16;
       ?column?       
----------------------
 36893488147419103232
(1 row)

SELECT '18446744073709551616'::int16 / 2;
      ?column?       
---------------------
 9223372036854775808
(1 row)

-- int16 op int2
SELECT '18446744073709551616'::int16 + 1::int2;
       ?column?       
----------------------
 18446744073709551617
(1 row)

SELECT 1::int2 + '18446744073709551616'::int16;
       ?column?       
----------------------
 18446744073709551617
(1 row)

SELECT '18446744073709551616'::int16 - 1::int2;
       ?column?       
----------------------
 18446744073709551615
(1 row)

SELECT '18446744073709551616'::int16 * 2::int2;
       ?column?       
----------------------
 36893488147419103232
(1 row)

SELECT '18446744073709551616'::int16 / 2::int2;
      ?column?       
---------------------
 9223372036854775808
(1 row)

-- =========================================================================
-- Aggregates with values exceeding int64 range
-- =========================================================================
CREATE TABLE int16_overflow_test (x int16);
INSERT INTO int16_overflow_test VALUES ('9223372036854775808'), ('9223372036854775808'); -- two 2^63 values
-- sum = 2^64 (exceeds int64, fits in int16)
SELECT sum(x) FROM int16_overflow_test;
         sum          
----------------------
 18446744073709551616
(1 row)

-- avg = 2^63 (returns numeric)
SELECT avg(x) FROM int16_overflow_test;
         avg         
---------------------
 9223372036854775808
(1 row)

-- min/max
SELECT min(x), max(x) FROM int16_overflow_test;
         min         |         max         
---------------------+---------------------
 9223372036854775808 | 9223372036854775808
(1 row)

-- Sum overflow: add MAX then add 2^63
INSERT INTO int16_overflow_test VALUES ('170141183460469231731687303715884105727');
SELECT sum(x) FROM int16_overflow_test; -- overflow
ERROR:  integer out of range
-- Clean up the overflow row
DELETE FROM int16_overflow_test WHERE x = '170141183460469231731687303715884105727'::int16;
-- avg with 3 values all = 2^64
DELETE FROM int16_overflow_test;
INSERT INTO int16_overflow_test VALUES ('18446744073709551616'), ('18446744073709551616'), ('18446744073709551616');
SELECT sum(x) FROM int16_overflow_test; -- 3 * 2^64
         sum          
----------------------
 55340232221128654848
(1 row)

SELECT avg(x) FROM int16_overflow_test; -- 2^64 as numeric
         avg          
----------------------
 18446744073709551616
(1 row)

DROP TABLE int16_overflow_test;
-- =========================================================================
-- int16_avg_state type (internal aggregate state for avg)
-- =========================================================================
-- The state type is internal-only (cannot accept direct input), so we
-- verify it works correctly through the avg() aggregate with large values
-- that exercise the INT128 sum accumulator.
CREATE TABLE int16_avg_state_test (x int16);
INSERT INTO int16_avg_state_test VALUES
    ('9223372036854775808'),   -- 2^63
    ('9223372036854775808'),   -- 2^63
    ('9223372036854775808'),   -- 2^63
    ('9223372036854775808'),   -- 2^63
    (NULL);                     -- should be skipped
-- avg = 2^63 (sum = 4 * 2^63 = 2^65, count = 4, avg = 2^63)
SELECT avg(x) FROM int16_avg_state_test;
         avg         
---------------------
 9223372036854775808
(1 row)

-- Larger values: sum exceeds int64 range significantly
DELETE FROM int16_avg_state_test;
INSERT INTO int16_avg_state_test VALUES
    ('18446744073709551616'),   -- 2^64
    ('18446744073709551616'),   -- 2^64
    ('18446744073709551616');   -- 2^64
-- avg = 2^64
SELECT avg(x) FROM int16_avg_state_test;
         avg          
----------------------
 18446744073709551616
(1 row)

DROP TABLE int16_avg_state_test;
