Parsed test spec with 3 sessions

starting permutation: reset s1read s2r2 s1w2 s2w1 s1c s2c ck
step reset: DELETE FROM noc; INSERT INTO noc VALUES (1, 0), (2, 0);
step s1read: SELECT v FROM noc WHERE k = 1;
v
-
0
(1 row)

step s2r2: SELECT v FROM noc WHERE k = 2;
v
-
0
(1 row)

step s1w2: UPDATE noc SET v = 1 WHERE k = 2;
step s2w1: UPDATE noc SET v = 42 WHERE k = 1;
step s1c: COMMIT;
step s2c: COMMIT;
ERROR:  could not serialize access due to read/write dependencies among transactions
step ck: SELECT k, v FROM noc ORDER BY k;
             SELECT CASE WHEN (SELECT v FROM noc WHERE k = 1) = 42
                          AND (SELECT v FROM noc WHERE k = 2) = 1
                         THEN 'bad_both_committed'
                         ELSE 'ok_aborted_or_serial' END AS invariant;
k|v
-+-
1|0
2|1
(2 rows)

invariant           
--------------------
ok_aborted_or_serial
(1 row)


starting permutation: reset s1noop s2r2 s1w2 s2w1 s1c s2c ck
step reset: DELETE FROM noc; INSERT INTO noc VALUES (1, 0), (2, 0);
step s1noop: INSERT INTO noc(k, v) VALUES (1, 99) ON CONFLICT (k) DO UPDATE SET v = 100 WHERE noc.v = 42;
step s2r2: SELECT v FROM noc WHERE k = 2;
v
-
0
(1 row)

step s1w2: UPDATE noc SET v = 1 WHERE k = 2;
step s2w1: UPDATE noc SET v = 42 WHERE k = 1; <waiting ...>
step s1c: COMMIT;
step s2w1: <... completed>
ERROR:  could not serialize access due to read/write dependencies among transactions
step s2c: COMMIT;
step ck: SELECT k, v FROM noc ORDER BY k;
             SELECT CASE WHEN (SELECT v FROM noc WHERE k = 1) = 42
                          AND (SELECT v FROM noc WHERE k = 2) = 1
                         THEN 'bad_both_committed'
                         ELSE 'ok_aborted_or_serial' END AS invariant;
k|v
-+-
1|0
2|1
(2 rows)

invariant           
--------------------
ok_aborted_or_serial
(1 row)

