Parsed test spec with 2 sessions

starting permutation: s2_vacuum_freeze s1_get_set_vm_flags_stats s1_update_table s1_get_cleared_vm_flags_stats s2_vacuum_freeze s1_get_set_vm_flags_stats s2_vacuum_freeze s1_select_from_index s2_delete_from_table s1_get_cleared_vm_flags_stats s2_vacuum_freeze s1_get_set_vm_flags_stats s1_commit s1_get_cleared_vm_flags_stats
pg_stat_force_next_flush
------------------------
                        
(1 row)

step s2_vacuum_freeze: 
    VACUUM FREEZE vestat;

step s1_get_set_vm_flags_stats: 
    SELECT pg_stat_force_next_flush();

    SELECT c.relallfrozen > frozen_flag_count as relallfrozen, c.relallvisible > all_visibile_flag_count as relallvisible
        FROM pg_class c, stats_state
        WHERE c.relname = 'vestat';

    UPDATE stats_state
        SET frozen_flag_count = c.relallfrozen,
            all_visibile_flag_count = c.relallvisible
        FROM pg_class c
        WHERE c.relname = 'vestat';

pg_stat_force_next_flush
------------------------
                        
(1 row)

relallfrozen|relallvisible
------------+-------------
t           |t            
(1 row)

step s1_update_table: 
    UPDATE vestat SET x = x + 1001 where x >= 2500;
    SELECT pg_stat_force_next_flush();

pg_stat_force_next_flush
------------------------
                        
(1 row)

step s1_get_cleared_vm_flags_stats: 
    SELECT pg_stat_force_next_flush();

    SELECT v.visible_page_marks_cleared > cleared_all_visibile_flag_count as visible_page_marks_cleared,
           v.frozen_page_marks_cleared > cleared_frozen_flag_count as frozen_page_marks_cleared
        FROM pg_stat_all_tables v, stats_state
        WHERE v.relname = 'vestat';

    UPDATE stats_state
        SET cleared_all_visibile_flag_count = v.visible_page_marks_cleared,
            cleared_frozen_flag_count = v.frozen_page_marks_cleared
        FROM pg_stat_all_tables v
        WHERE v.relname = 'vestat';

pg_stat_force_next_flush
------------------------
                        
(1 row)

visible_page_marks_cleared|frozen_page_marks_cleared
--------------------------+-------------------------
t                         |t                        
(1 row)

step s2_vacuum_freeze: 
    VACUUM FREEZE vestat;

step s1_get_set_vm_flags_stats: 
    SELECT pg_stat_force_next_flush();

    SELECT c.relallfrozen > frozen_flag_count as relallfrozen, c.relallvisible > all_visibile_flag_count as relallvisible
        FROM pg_class c, stats_state
        WHERE c.relname = 'vestat';

    UPDATE stats_state
        SET frozen_flag_count = c.relallfrozen,
            all_visibile_flag_count = c.relallvisible
        FROM pg_class c
        WHERE c.relname = 'vestat';

pg_stat_force_next_flush
------------------------
                        
(1 row)

relallfrozen|relallvisible
------------+-------------
t           |t            
(1 row)

step s2_vacuum_freeze: 
    VACUUM FREEZE vestat;

step s1_select_from_index: 
    BEGIN;
    SELECT count(x) FROM vestat WHERE x > 2000;

count
-----
 3000
(1 row)

step s2_delete_from_table: 
    DELETE FROM vestat WHERE x > 4930;

step s1_get_cleared_vm_flags_stats: 
    SELECT pg_stat_force_next_flush();

    SELECT v.visible_page_marks_cleared > cleared_all_visibile_flag_count as visible_page_marks_cleared,
           v.frozen_page_marks_cleared > cleared_frozen_flag_count as frozen_page_marks_cleared
        FROM pg_stat_all_tables v, stats_state
        WHERE v.relname = 'vestat';

    UPDATE stats_state
        SET cleared_all_visibile_flag_count = v.visible_page_marks_cleared,
            cleared_frozen_flag_count = v.frozen_page_marks_cleared
        FROM pg_stat_all_tables v
        WHERE v.relname = 'vestat';

pg_stat_force_next_flush
------------------------
                        
(1 row)

visible_page_marks_cleared|frozen_page_marks_cleared
--------------------------+-------------------------
f                         |f                        
(1 row)

step s2_vacuum_freeze: 
    VACUUM FREEZE vestat;

step s1_get_set_vm_flags_stats: 
    SELECT pg_stat_force_next_flush();

    SELECT c.relallfrozen > frozen_flag_count as relallfrozen, c.relallvisible > all_visibile_flag_count as relallvisible
        FROM pg_class c, stats_state
        WHERE c.relname = 'vestat';

    UPDATE stats_state
        SET frozen_flag_count = c.relallfrozen,
            all_visibile_flag_count = c.relallvisible
        FROM pg_class c
        WHERE c.relname = 'vestat';

pg_stat_force_next_flush
------------------------
                        
(1 row)

relallfrozen|relallvisible
------------+-------------
f           |f            
(1 row)

step s1_commit: 
    COMMIT;

step s1_get_cleared_vm_flags_stats: 
    SELECT pg_stat_force_next_flush();

    SELECT v.visible_page_marks_cleared > cleared_all_visibile_flag_count as visible_page_marks_cleared,
           v.frozen_page_marks_cleared > cleared_frozen_flag_count as frozen_page_marks_cleared
        FROM pg_stat_all_tables v, stats_state
        WHERE v.relname = 'vestat';

    UPDATE stats_state
        SET cleared_all_visibile_flag_count = v.visible_page_marks_cleared,
            cleared_frozen_flag_count = v.frozen_page_marks_cleared
        FROM pg_stat_all_tables v
        WHERE v.relname = 'vestat';

pg_stat_force_next_flush
------------------------
                        
(1 row)

visible_page_marks_cleared|frozen_page_marks_cleared
--------------------------+-------------------------
t                         |t                        
(1 row)

