CREATE TABLE brintest (byteacol bytea,
	charcol "char",
	namecol name,
	int8col bigint,
	int2col smallint,
	int4col integer,
	textcol text,
	oidcol oid,
	tidcol tid,
	float4col real,
	float8col double precision,
	macaddrcol macaddr,
	inetcol inet,
	cidrcol cidr,
	bpcharcol character,
	datecol date,
	timecol time without time zone,
	timestampcol timestamp without time zone,
	timestamptzcol timestamp with time zone,
	intervalcol interval,
	timetzcol time with time zone,
	bitcol bit(10),
	varbitcol bit varying(16),
	numericcol numeric,
	uuidcol uuid,
	int4rangecol int4range,
	lsncol pg_lsn,
	boxcol box
) WITH (fillfactor=10, autovacuum_enabled=off);
INSERT INTO brintest SELECT
	repeat(stringu1, 8)::bytea,
	substr(stringu1, 1, 1)::"char",
	stringu1::name, 142857 * tenthous,
	thousand,
	twothousand,
	repeat(stringu1, 8),
	unique1::oid,
	format('(%s,%s)', tenthous, twenty)::tid,
	(four + 1.0)/(hundred+1),
	odd::float8 / (tenthous + 1),
	format('%s:00:%s:00:%s:00', to_hex(odd), to_hex(even), to_hex(hundred))::macaddr,
	inet '10.2.3.4/24' + tenthous,
	cidr '10.2.3/24' + tenthous,
	substr(stringu1, 1, 1)::bpchar,
	date '1995-08-15' + tenthous,
	time '01:20:30' + thousand * interval '18.5 second',
	timestamp '1942-07-23 03:05:09' + tenthous * interval '36.38 hours',
	timestamptz '1972-10-10 03:00' + thousand * interval '1 hour',
	justify_days(justify_hours(tenthous * interval '12 minutes')),
	timetz '01:30:20+02' + hundred * interval '15 seconds',
	thousand::bit(10),
	tenthous::bit(16)::varbit,
	tenthous::numeric(36,30) * fivethous * even / (hundred + 1),
	format('%s%s-%s-%s-%s-%s%s%s', to_char(tenthous, 'FM0000'), to_char(tenthous, 'FM0000'), to_char(tenthous, 'FM0000'), to_char(tenthous, 'FM0000'), to_char(tenthous, 'FM0000'), to_char(tenthous, 'FM0000'), to_char(tenthous, 'FM0000'), to_char(tenthous, 'FM0000'))::uuid,
	int4range(thousand, twothousand),
	format('%s/%s%s', odd, even, tenthous)::pg_lsn,
	box(point(odd, even), point(thousand, twothousand))
FROM tenk1 ORDER BY unique2 LIMIT 100;
-- throw in some NULL's and different values
INSERT INTO brintest (inetcol, cidrcol, int4rangecol) SELECT
	inet 'fe80::6e40:8ff:fea9:8c46' + tenthous,
	cidr 'fe80::6e40:8ff:fea9:8c46' + tenthous,
	'empty'::int4range
FROM tenk1 ORDER BY thousand, tenthous LIMIT 25;
CREATE INDEX brinidx ON brintest USING brin (
	byteacol,
	charcol,
	namecol,
	int8col,
	int2col,
	int4col,
	textcol,
	oidcol,
	tidcol,
	float4col,
	float8col,
	macaddrcol,
	inetcol inet_inclusion_ops,
	inetcol inet_minmax_ops,
	cidrcol inet_inclusion_ops,
	cidrcol inet_minmax_ops,
	bpcharcol,
	datecol,
	timecol,
	timestampcol,
	timestamptzcol,
	intervalcol,
	timetzcol,
	bitcol,
	varbitcol,
	numericcol,
	uuidcol,
	int4rangecol,
	lsncol,
	boxcol
) with (pages_per_range = 1);
CREATE TABLE brinopers (colname name, typ text,
	op text[], value text[], matches int[],
	check (cardinality(op) = cardinality(value)),
	check (cardinality(op) = cardinality(matches)));
INSERT INTO brinopers VALUES
	('byteacol', 'bytea',
	 '{>, >=, =, <=, <}',
	 '{AAAAAA, AAAAAA, BNAAAABNAAAABNAAAABNAAAABNAAAABNAAAABNAAAABNAAAA, ZZZZZZ, ZZZZZZ}',
	 '{100, 100, 1, 100, 100}'),
	('charcol', '"char"',
	 '{>, >=, =, <=, <}',
	 '{A, A, M, Z, Z}',
	 '{97, 100, 6, 100, 98}'),
	('namecol', 'name',
	 '{>, >=, =, <=, <}',
	 '{AAAAAA, AAAAAA, MAAAAA, ZZAAAA, ZZAAAA}',
	 '{100, 100, 2, 100, 100}'),
	('int2col', 'int2',
	 '{>, >=, =, <=, <}',
	 '{0, 0, 800, 999, 999}',
	 '{100, 100, 1, 100, 100}'),
	('int2col', 'int4',
	 '{>, >=, =, <=, <}',
	 '{0, 0, 800, 999, 1999}',
	 '{100, 100, 1, 100, 100}'),
	('int2col', 'int8',
	 '{>, >=, =, <=, <}',
	 '{0, 0, 800, 999, 1428427143}',
	 '{100, 100, 1, 100, 100}'),
	('int4col', 'int2',
	 '{>, >=, =, <=, <}',
	 '{0, 0, 800, 1999, 1999}',
	 '{100, 100, 1, 100, 100}'),
	('int4col', 'int4',
	 '{>, >=, =, <=, <}',
	 '{0, 0, 800, 1999, 1999}',
	 '{100, 100, 1, 100, 100}'),
	('int4col', 'int8',
	 '{>, >=, =, <=, <}',
	 '{0, 0, 800, 1999, 1428427143}',
	 '{100, 100, 1, 100, 100}'),
	('int8col', 'int2',
	 '{>, >=}',
	 '{0, 0}',
	 '{100, 100}'),
	('int8col', 'int4',
	 '{>, >=}',
	 '{0, 0}',
	 '{100, 100}'),
	('int8col', 'int8',
	 '{>, >=, =, <=, <}',
	 '{0, 0, 1257141600, 1428427143, 1428427143}',
	 '{100, 100, 1, 100, 100}'),
	('textcol', 'text',
	 '{>, >=, =, <=, <}',
	 '{ABABAB, ABABAB, BNAAAABNAAAABNAAAABNAAAABNAAAABNAAAABNAAAABNAAAA, ZZAAAA, ZZAAAA}',
	 '{100, 100, 1, 100, 100}'),
	('oidcol', 'oid',
	 '{>, >=, =, <=, <}',
	 '{0, 0, 8800, 9999, 9999}',
	 '{100, 100, 1, 100, 100}'),
	('tidcol', 'tid',
	 '{>, >=, =, <=, <}',
	 '{"(0,0)", "(0,0)", "(8800,0)", "(9999,19)", "(9999,19)"}',
	 '{100, 100, 1, 100, 100}'),
	('float4col', 'float4',
	 '{>, >=, =, <=, <}',
	 '{0.0103093, 0.0103093, 1, 1, 1}',
	 '{100, 100, 4, 100, 96}'),
	('float4col', 'float8',
	 '{>, >=, =, <=, <}',
	 '{0.0103093, 0.0103093, 1, 1, 1}',
	 '{100, 100, 4, 100, 96}'),
	('float8col', 'float4',
	 '{>, >=, =, <=, <}',
	 '{0, 0, 0, 1.98, 1.98}',
	 '{99, 100, 1, 100, 100}'),
	('float8col', 'float8',
	 '{>, >=, =, <=, <}',
	 '{0, 0, 0, 1.98, 1.98}',
	 '{99, 100, 1, 100, 100}'),
	('macaddrcol', 'macaddr',
	 '{>, >=, =, <=, <}',
	 '{00:00:01:00:00:00, 00:00:01:00:00:00, 2c:00:2d:00:16:00, ff:fe:00:00:00:00, ff:fe:00:00:00:00}',
	 '{99, 100, 2, 100, 100}'),
	('inetcol', 'inet',
	 '{&&, =, <, <=, >, >=, >>=, >>, <<=, <<}',
	 '{10/8, 10.2.14.231/24, 255.255.255.255, 255.255.255.255, 0.0.0.0, 0.0.0.0, 10.2.14.231/24, 10.2.14.231/25, 10.2.14.231/8, 0/0}',
	 '{100, 1, 100, 100, 125, 125, 2, 2, 100, 100}'),
	('inetcol', 'inet',
	 '{&&, >>=, <<=, =}',
	 '{fe80::6e40:8ff:fea9:a673/32, fe80::6e40:8ff:fea9:8c46, fe80::6e40:8ff:fea9:a673/32, fe80::6e40:8ff:fea9:8c46}',
	 '{25, 1, 25, 1}'),
	('inetcol', 'cidr',
	 '{&&, <, <=, >, >=, >>=, >>, <<=, <<}',
	 '{10/8, 255.255.255.255, 255.255.255.255, 0.0.0.0, 0.0.0.0, 10.2.14/24, 10.2.14/25, 10/8, 0/0}',
	 '{100, 100, 100, 125, 125, 2, 2, 100, 100}'),
	('inetcol', 'cidr',
	 '{&&, >>=, <<=, =}',
	 '{fe80::/32, fe80::6e40:8ff:fea9:8c46, fe80::/32, fe80::6e40:8ff:fea9:8c46}',
	 '{25, 1, 25, 1}'),
	('cidrcol', 'inet',
	 '{&&, =, <, <=, >, >=, >>=, >>, <<=, <<}',
	 '{10/8, 10.2.14/24, 255.255.255.255, 255.255.255.255, 0.0.0.0, 0.0.0.0, 10.2.14.231/24, 10.2.14.231/25, 10.2.14.231/8, 0/0}',
	 '{100, 2, 100, 100, 125, 125, 2, 2, 100, 100}'),
	('cidrcol', 'inet',
	 '{&&, >>=, <<=, =}',
	 '{fe80::6e40:8ff:fea9:a673/32, fe80::6e40:8ff:fea9:8c46, fe80::6e40:8ff:fea9:a673/32, fe80::6e40:8ff:fea9:8c46}',
	 '{25, 1, 25, 1}'),
	('cidrcol', 'cidr',
	 '{&&, =, <, <=, >, >=, >>=, >>, <<=, <<}',
	 '{10/8, 10.2.14/24, 255.255.255.255, 255.255.255.255, 0.0.0.0, 0.0.0.0, 10.2.14/24, 10.2.14/25, 10/8, 0/0}',
	 '{100, 2, 100, 100, 125, 125, 2, 2, 100, 100}'),
	('cidrcol', 'cidr',
	 '{&&, >>=, <<=, =}',
	 '{fe80::/32, fe80::6e40:8ff:fea9:8c46, fe80::/32, fe80::6e40:8ff:fea9:8c46}',
	 '{25, 1, 25, 1}'),
	('bpcharcol', 'bpchar',
	 '{>, >=, =, <=, <}',
	 '{A, A, W, Z, Z}',
	 '{97, 100, 6, 100, 98}'),
	('datecol', 'date',
	 '{>, >=, =, <=, <}',
	 '{1995-08-15, 1995-08-15, 2009-12-01, 2022-12-30, 2022-12-30}',
	 '{100, 100, 1, 100, 100}'),
	('timecol', 'time',
	 '{>, >=, =, <=, <}',
	 '{01:20:30, 01:20:30, 02:28:57, 06:28:31.5, 06:28:31.5}',
	 '{100, 100, 1, 100, 100}'),
	('timestampcol', 'timestamp',
	 '{>, >=, =, <=, <}',
	 '{1942-07-23 03:05:09, 1942-07-23 03:05:09, 1964-03-24 19:26:45, 1984-01-20 22:42:21, 1984-01-20 22:42:21}',
	 '{100, 100, 1, 100, 100}'),
	('timestampcol', 'timestamptz',
	 '{>, >=, =, <=, <}',
	 '{1942-07-23 03:05:09, 1942-07-23 03:05:09, 1964-03-24 19:26:45, 1984-01-20 22:42:21, 1984-01-20 22:42:21}',
	 '{100, 100, 1, 100, 100}'),
	('timestamptzcol', 'timestamptz',
	 '{>, >=, =, <=, <}',
	 '{1972-10-10 03:00:00-04, 1972-10-10 03:00:00-04, 1972-10-19 09:00:00-07, 1972-11-20 19:00:00-03, 1972-11-20 19:00:00-03}',
	 '{100, 100, 1, 100, 100}'),
	('intervalcol', 'interval',
	 '{>, >=, =, <=, <}',
	 '{00:00:00, 00:00:00, 1 mons 13 days 12:24, 2 mons 23 days 07:48:00, 1 year}',
	 '{100, 100, 1, 100, 100}'),
	('timetzcol', 'timetz',
	 '{>, >=, =, <=, <}',
	 '{01:30:20+02, 01:30:20+02, 01:35:50+02, 23:55:05+02, 23:55:05+02}',
	 '{99, 100, 2, 100, 100}'),
	('bitcol', 'bit(10)',
	 '{>, >=, =, <=, <}',
	 '{0000000010, 0000000010, 0011011110, 1111111000, 1111111000}',
	 '{100, 100, 1, 100, 100}'),
	('varbitcol', 'varbit(16)',
	 '{>, >=, =, <=, <}',
	 '{0000000000000100, 0000000000000100, 0001010001100110, 1111111111111000, 1111111111111000}',
	 '{100, 100, 1, 100, 100}'),
	('numericcol', 'numeric',
	 '{>, >=, =, <=, <}',
	 '{0.00, 0.01, 2268164.347826086956521739130434782609, 99470151.9, 99470151.9}',
	 '{100, 100, 1, 100, 100}'),
	('uuidcol', 'uuid',
	 '{>, >=, =, <=, <}',
	 '{00040004-0004-0004-0004-000400040004, 00040004-0004-0004-0004-000400040004, 52225222-5222-5222-5222-522252225222, 99989998-9998-9998-9998-999899989998, 99989998-9998-9998-9998-999899989998}',
	 '{100, 100, 1, 100, 100}'),
	('int4rangecol', 'int4range',
	 '{<<, &<, &&, &>, >>, @>, <@, =, <, <=, >, >=}',
	 '{"[10000,)","[10000,)","(,]","[3,4)","[36,44)","(1500,1501]","[3,4)","[222,1222)","[36,44)","[43,1043)","[367,4466)","[519,)"}',
	 '{53, 53, 53, 53, 50, 22, 72, 1, 74, 75, 34, 21}'),
	('int4rangecol', 'int4range',
	 '{@>, <@, =, <=, >, >=}',
	 '{empty, empty, empty, empty, empty, empty}',
	 '{125, 72, 72, 72, 53, 125}'),
	('int4rangecol', 'int4',
	 '{@>}',
	 '{1500}',
	 '{22}'),
	('lsncol', 'pg_lsn',
	 '{>, >=, =, <=, <, IS, IS NOT}',
	 '{0/1200, 0/1200, 44/455222, 198/1999799, 198/1999799, NULL, NULL}',
	 '{100, 100, 1, 100, 100, 25, 100}'),
	('boxcol', 'point',
	 '{@>}',
	 '{"(500,43)"}',
	 '{11}'),
	('boxcol', 'box',
	 '{<<, &<, &&, &>, >>, <<|, &<|, |&>, |>>, @>, <@, ~=}',
	 '{"((1000,2000),(3000,4000))","((1,2),(3000,4000))","((1,2),(3000,4000))","((1,2),(3000,4000))","((1,2),(3,4))","((1000,2000),(3000,4000))","((1,2000),(3,4000))","((1000,2),(3000,4))","((1,2),(3,4))","((1,2),(300,400))","((1,2),(3000,4000))","((222,1222),(44,45))"}',
	 '{100, 100, 100, 99, 96, 100, 100, 99, 96, 1, 99, 1}');
DO $x$
DECLARE
	r record;
	r2 record;
	cond text;
	idx_ctids tid[];
	ss_ctids tid[];
	count int;
	plan_ok bool;
	plan_line text;
BEGIN
	FOR r IN SELECT colname, oper, typ, value[ordinality], matches[ordinality] FROM brinopers, unnest(op) WITH ORDINALITY AS oper LOOP

		-- prepare the condition
		IF r.value IS NULL THEN
			cond := format('%I %s %L', r.colname, r.oper, r.value);
		ELSE
			cond := format('%I %s %L::%s', r.colname, r.oper, r.value, r.typ);
		END IF;

		-- run the query using the brin index
		SET enable_seqscan = 0;
		SET enable_bitmapscan = 1;

		plan_ok := false;
		FOR plan_line IN EXECUTE format($y$EXPLAIN SELECT array_agg(ctid) FROM brintest WHERE %s $y$, cond) LOOP
			IF plan_line LIKE '%Bitmap Heap Scan on brintest%' THEN
				plan_ok := true;
			END IF;
		END LOOP;
		IF NOT plan_ok THEN
			RAISE WARNING 'did not get bitmap indexscan plan for %', r;
		END IF;

		EXECUTE format($y$SELECT array_agg(ctid) FROM brintest WHERE %s $y$, cond)
			INTO idx_ctids;

		-- run the query using a seqscan
		SET enable_seqscan = 1;
		SET enable_bitmapscan = 0;

		plan_ok := false;
		FOR plan_line IN EXECUTE format($y$EXPLAIN SELECT array_agg(ctid) FROM brintest WHERE %s $y$, cond) LOOP
			IF plan_line LIKE '%Seq Scan on brintest%' THEN
				plan_ok := true;
			END IF;
		END LOOP;
		IF NOT plan_ok THEN
			RAISE WARNING 'did not get seqscan plan for %', r;
		END IF;

		EXECUTE format($y$SELECT array_agg(ctid) FROM brintest WHERE %s $y$, cond)
			INTO ss_ctids;

		-- make sure both return the same results
		count := array_length(idx_ctids, 1);

		IF NOT (count = array_length(ss_ctids, 1) AND
				idx_ctids @> ss_ctids AND
				idx_ctids <@ ss_ctids) THEN
			-- report the results of each scan to make the differences obvious
			RAISE WARNING 'something not right in %: count %', r, count;
			SET enable_seqscan = 1;
			SET enable_bitmapscan = 0;
			FOR r2 IN EXECUTE 'SELECT ' || r.colname || ' FROM brintest WHERE ' || cond LOOP
				RAISE NOTICE 'seqscan: %', r2;
			END LOOP;

			SET enable_seqscan = 0;
			SET enable_bitmapscan = 1;
			FOR r2 IN EXECUTE 'SELECT ' || r.colname || ' FROM brintest WHERE ' || cond LOOP
				RAISE NOTICE 'bitmapscan: %', r2;
			END LOOP;
		END IF;

		-- make sure we found expected number of matches
		IF count != r.matches THEN RAISE WARNING 'unexpected number of results % for %', count, r; END IF;
	END LOOP;
END;
$x$;
RESET enable_seqscan;
RESET enable_bitmapscan;
INSERT INTO brintest SELECT
	repeat(stringu1, 42)::bytea,
	substr(stringu1, 1, 1)::"char",
	stringu1::name, 142857 * tenthous,
	thousand,
	twothousand,
	repeat(stringu1, 42),
	unique1::oid,
	format('(%s,%s)', tenthous, twenty)::tid,
	(four + 1.0)/(hundred+1),
	odd::float8 / (tenthous + 1),
	format('%s:00:%s:00:%s:00', to_hex(odd), to_hex(even), to_hex(hundred))::macaddr,
	inet '10.2.3.4' + tenthous,
	cidr '10.2.3/24' + tenthous,
	substr(stringu1, 1, 1)::bpchar,
	date '1995-08-15' + tenthous,
	time '01:20:30' + thousand * interval '18.5 second',
	timestamp '1942-07-23 03:05:09' + tenthous * interval '36.38 hours',
	timestamptz '1972-10-10 03:00' + thousand * interval '1 hour',
	justify_days(justify_hours(tenthous * interval '12 minutes')),
	timetz '01:30:20' + hundred * interval '15 seconds',
	thousand::bit(10),
	tenthous::bit(16)::varbit,
	tenthous::numeric(36,30) * fivethous * even / (hundred + 1),
	format('%s%s-%s-%s-%s-%s%s%s', to_char(tenthous, 'FM0000'), to_char(tenthous, 'FM0000'), to_char(tenthous, 'FM0000'), to_char(tenthous, 'FM0000'), to_char(tenthous, 'FM0000'), to_char(tenthous, 'FM0000'), to_char(tenthous, 'FM0000'), to_char(tenthous, 'FM0000'))::uuid,
	int4range(thousand, twothousand),
	format('%s/%s%s', odd, even, tenthous)::pg_lsn,
	box(point(odd, even), point(thousand, twothousand))
FROM tenk1 ORDER BY unique2 LIMIT 5 OFFSET 5;
SELECT brin_desummarize_range('brinidx', 0);
 brin_desummarize_range 
------------------------
 
(1 row)

VACUUM brintest;  -- force a summarization cycle in brinidx
UPDATE brintest SET int8col = int8col * int4col;
UPDATE brintest SET textcol = '' WHERE textcol IS NOT NULL;
-- Tests for brin_summarize_new_values
SELECT brin_summarize_new_values('brintest'); -- error, not an index
ERROR:  "brintest" is not an index
SELECT brin_summarize_new_values('tenk1_unique1'); -- error, not a BRIN index
ERROR:  "tenk1_unique1" is not a BRIN index
SELECT brin_summarize_new_values('brinidx'); -- ok, no change expected
 brin_summarize_new_values 
---------------------------
                         0
(1 row)

-- Tests for brin_desummarize_range
SELECT brin_desummarize_range('brinidx', -1); -- error, invalid range
ERROR:  block number out of range: -1
SELECT brin_desummarize_range('brinidx', 0);
 brin_desummarize_range 
------------------------
 
(1 row)

SELECT brin_desummarize_range('brinidx', 0);
 brin_desummarize_range 
------------------------
 
(1 row)

SELECT brin_desummarize_range('brinidx', 100000000);
 brin_desummarize_range 
------------------------
 
(1 row)

-- Test brin_summarize_range
CREATE TABLE brin_summarize (
    value int
) WITH (fillfactor=10, autovacuum_enabled=false);
CREATE INDEX brin_summarize_idx ON brin_summarize USING brin (value) WITH (pages_per_range=2);
-- Fill a few pages
DO $$
DECLARE curtid tid;
BEGIN
  LOOP
    INSERT INTO brin_summarize VALUES (1) RETURNING ctid INTO curtid;
    EXIT WHEN curtid > tid '(2, 0)';
  END LOOP;
END;
$$;
-- summarize one range
SELECT brin_summarize_range('brin_summarize_idx', 0);
 brin_summarize_range 
----------------------
                    0
(1 row)

-- nothing: already summarized
SELECT brin_summarize_range('brin_summarize_idx', 1);
 brin_summarize_range 
----------------------
                    0
(1 row)

-- summarize one range
SELECT brin_summarize_range('brin_summarize_idx', 2);
 brin_summarize_range 
----------------------
                    1
(1 row)

-- nothing: page doesn't exist in table
SELECT brin_summarize_range('brin_summarize_idx', 4294967295);
 brin_summarize_range 
----------------------
                    0
(1 row)

-- invalid block number values
SELECT brin_summarize_range('brin_summarize_idx', -1);
ERROR:  block number out of range: -1
SELECT brin_summarize_range('brin_summarize_idx', 4294967296);
ERROR:  block number out of range: 4294967296
-- test value merging in add_value
CREATE TABLE brintest_2 (n numrange);
CREATE INDEX brinidx_2 ON brintest_2 USING brin (n);
INSERT INTO brintest_2 VALUES ('empty');
INSERT INTO brintest_2 VALUES (numrange(0, 2^1000::numeric));
INSERT INTO brintest_2 VALUES ('(-1, 0)');
SELECT brin_desummarize_range('brinidx', 0);
 brin_desummarize_range 
------------------------
 
(1 row)

SELECT brin_summarize_range('brinidx', 0);
 brin_summarize_range 
----------------------
                    1
(1 row)

DROP TABLE brintest_2;
-- test brin cost estimates behave sanely based on correlation of values
CREATE TABLE brin_test (a INT, b INT);
INSERT INTO brin_test SELECT x/100,x%100 FROM generate_series(1,10000) x(x);
CREATE INDEX brin_test_a_idx ON brin_test USING brin (a) WITH (pages_per_range = 2);
CREATE INDEX brin_test_b_idx ON brin_test USING brin (b) WITH (pages_per_range = 2);
VACUUM ANALYZE brin_test;
-- Ensure brin index is used when columns are perfectly correlated
EXPLAIN (COSTS OFF) SELECT * FROM brin_test WHERE a = 1;
                 QUERY PLAN                 
--------------------------------------------
 Bitmap Heap Scan on brin_test
   Recheck Cond: (a = 1)
   ->  Bitmap Index Scan on brin_test_a_idx
         Index Cond: (a = 1)
(4 rows)

-- Ensure brin index is not used when values are not correlated
EXPLAIN (COSTS OFF) SELECT * FROM brin_test WHERE b = 1;
      QUERY PLAN       
-----------------------
 Seq Scan on brin_test
   Filter: (b = 1)
(2 rows)

-- make sure data are properly de-toasted in BRIN index
CREATE TABLE brintest_3 (a text, b text, c text, d text);
-- long random strings (~2000 chars each, so ~6kB for min/max on two
-- columns) to trigger toasting
WITH rand_value AS (SELECT string_agg(fipshash(i::text),'') AS val FROM generate_series(1,60) s(i))
INSERT INTO brintest_3
SELECT val, val, val, val FROM rand_value;
CREATE INDEX brin_test_toast_idx ON brintest_3 USING brin (b, c);
DELETE FROM brintest_3;
-- We need to wait a bit for all transactions to complete, so that the
-- vacuum actually removes the TOAST rows. Creating an index concurrently
-- is a one way to achieve that, because it does exactly such wait.
CREATE INDEX CONCURRENTLY brin_test_temp_idx ON brintest_3(a);
DROP INDEX brin_test_temp_idx;
-- vacuum the table, to discard TOAST data
VACUUM brintest_3;
-- retry insert with a different random-looking (but deterministic) value
-- the value is different, and so should replace either min or max in the
-- brin summary
WITH rand_value AS (SELECT string_agg(fipshash((-i)::text),'') AS val FROM generate_series(1,60) s(i))
INSERT INTO brintest_3
SELECT val, val, val, val FROM rand_value;
-- now try some queries, accessing the brin index
SET enable_seqscan = off;
EXPLAIN (COSTS OFF)
SELECT * FROM brintest_3 WHERE b < '0';
                   QUERY PLAN                   
------------------------------------------------
 Bitmap Heap Scan on brintest_3
   Recheck Cond: (b < '0'::text)
   ->  Bitmap Index Scan on brin_test_toast_idx
         Index Cond: (b < '0'::text)
(4 rows)

SELECT * FROM brintest_3 WHERE b < '0';
 a | b | c | d 
---+---+---+---
(0 rows)

DROP TABLE brintest_3;
RESET enable_seqscan;
-- test an unlogged table, mostly to get coverage of brinbuildempty
CREATE UNLOGGED TABLE brintest_unlogged (n numrange);
CREATE INDEX brinidx_unlogged ON brintest_unlogged USING brin (n);
INSERT INTO brintest_unlogged VALUES (numrange(0, 2^1000::numeric));
DROP TABLE brintest_unlogged;
-- do some tests on IN clauses for simple data types
CREATE TABLE brin_in_test_1 (a INT, b BIGINT) WITH (fillfactor=10);
INSERT INTO brin_in_test_1
SELECT i/5 + mod(991 * i + 617, 20),
       i/10 + mod(853 * i + 491, 30)
  FROM generate_series(1,1000) s(i);
CREATE INDEX brin_in_test_1_idx_1 ON brin_in_test_1 USING brin (a int4_minmax_ops) WITH (pages_per_range=1);
CREATE INDEX brin_in_test_1_idx_2 ON brin_in_test_1 USING brin (b int8_minmax_ops) WITH (pages_per_range=1);
SET enable_seqscan=off;
-- int: equalities
EXPLAIN (COSTS OFF)
SELECT COUNT(*) FROM brin_in_test_1 WHERE a IN (113);
                      QUERY PLAN                       
-------------------------------------------------------
 Aggregate
   ->  Bitmap Heap Scan on brin_in_test_1
         Recheck Cond: (a = 113)
         ->  Bitmap Index Scan on brin_in_test_1_idx_1
               Index Cond: (a = 113)
(5 rows)

SELECT COUNT(*) FROM brin_in_test_1 WHERE a IN (113);
 count 
-------
     8
(1 row)

EXPLAIN (COSTS OFF)
SELECT COUNT(*) FROM brin_in_test_1 WHERE a IN (113, NULL);
                          QUERY PLAN                           
---------------------------------------------------------------
 Aggregate
   ->  Bitmap Heap Scan on brin_in_test_1
         Recheck Cond: (a = ANY ('{113,NULL}'::integer[]))
         ->  Bitmap Index Scan on brin_in_test_1_idx_1
               Index Cond: (a = ANY ('{113,NULL}'::integer[]))
(5 rows)

SELECT COUNT(*) FROM brin_in_test_1 WHERE a IN (113, NULL);
 count 
-------
     8
(1 row)

EXPLAIN (COSTS OFF)
SELECT COUNT(*) FROM brin_in_test_1 WHERE a IN (NULL, NULL);
                           QUERY PLAN                           
----------------------------------------------------------------
 Aggregate
   ->  Bitmap Heap Scan on brin_in_test_1
         Recheck Cond: (a = ANY ('{NULL,NULL}'::integer[]))
         ->  Bitmap Index Scan on brin_in_test_1_idx_1
               Index Cond: (a = ANY ('{NULL,NULL}'::integer[]))
(5 rows)

SELECT COUNT(*) FROM brin_in_test_1 WHERE a IN (NULL, NULL);
 count 
-------
     0
(1 row)

EXPLAIN (COSTS OFF)
SELECT COUNT(*) FROM brin_in_test_1 WHERE a IN (113, 177);
                          QUERY PLAN                          
--------------------------------------------------------------
 Aggregate
   ->  Bitmap Heap Scan on brin_in_test_1
         Recheck Cond: (a = ANY ('{113,177}'::integer[]))
         ->  Bitmap Index Scan on brin_in_test_1_idx_1
               Index Cond: (a = ANY ('{113,177}'::integer[]))
(5 rows)

SELECT COUNT(*) FROM brin_in_test_1 WHERE a IN (113, 177);
 count 
-------
    16
(1 row)

EXPLAIN (COSTS OFF)
SELECT COUNT(*) FROM brin_in_test_1 WHERE a IN (113, 177, NULL);
                            QUERY PLAN                             
-------------------------------------------------------------------
 Aggregate
   ->  Bitmap Heap Scan on brin_in_test_1
         Recheck Cond: (a = ANY ('{113,177,NULL}'::integer[]))
         ->  Bitmap Index Scan on brin_in_test_1_idx_1
               Index Cond: (a = ANY ('{113,177,NULL}'::integer[]))
(5 rows)

SELECT COUNT(*) FROM brin_in_test_1 WHERE a IN (113, 177, NULL);
 count 
-------
    16
(1 row)

EXPLAIN (COSTS OFF)
SELECT COUNT(*) FROM brin_in_test_1 WHERE a IN (113, 177, 25);
                           QUERY PLAN                            
-----------------------------------------------------------------
 Aggregate
   ->  Bitmap Heap Scan on brin_in_test_1
         Recheck Cond: (a = ANY ('{113,177,25}'::integer[]))
         ->  Bitmap Index Scan on brin_in_test_1_idx_1
               Index Cond: (a = ANY ('{113,177,25}'::integer[]))
(5 rows)

SELECT COUNT(*) FROM brin_in_test_1 WHERE a IN (113, 177, 25);
 count 
-------
    24
(1 row)

EXPLAIN (COSTS OFF)
SELECT COUNT(*) FROM brin_in_test_1 WHERE a IN (NULL, 113, 177, 25);
                              QUERY PLAN                              
----------------------------------------------------------------------
 Aggregate
   ->  Bitmap Heap Scan on brin_in_test_1
         Recheck Cond: (a = ANY ('{NULL,113,177,25}'::integer[]))
         ->  Bitmap Index Scan on brin_in_test_1_idx_1
               Index Cond: (a = ANY ('{NULL,113,177,25}'::integer[]))
(5 rows)

SELECT COUNT(*) FROM brin_in_test_1 WHERE a IN (NULL, 113, 177, 25);
 count 
-------
    24
(1 row)

-- int: less than
EXPLAIN (COSTS OFF)
SELECT COUNT(*) FROM brin_in_test_1 WHERE a < ANY (ARRAY[30]);
                       QUERY PLAN                        
---------------------------------------------------------
 Aggregate
   ->  Bitmap Heap Scan on brin_in_test_1
         Recheck Cond: (a < ANY ('{30}'::integer[]))
         ->  Bitmap Index Scan on brin_in_test_1_idx_1
               Index Cond: (a < ANY ('{30}'::integer[]))
(5 rows)

SELECT COUNT(*) FROM brin_in_test_1 WHERE a < ANY (ARRAY[30]);
 count 
-------
   103
(1 row)

EXPLAIN (COSTS OFF)
SELECT COUNT(*) FROM brin_in_test_1 WHERE a < ANY (ARRAY[20, NULL]);
                          QUERY PLAN                          
--------------------------------------------------------------
 Aggregate
   ->  Bitmap Heap Scan on brin_in_test_1
         Recheck Cond: (a < ANY ('{20,NULL}'::integer[]))
         ->  Bitmap Index Scan on brin_in_test_1_idx_1
               Index Cond: (a < ANY ('{20,NULL}'::integer[]))
(5 rows)

SELECT COUNT(*) FROM brin_in_test_1 WHERE a < ANY (ARRAY[20, NULL]);
 count 
-------
    51
(1 row)

EXPLAIN (COSTS OFF)
SELECT COUNT(*) FROM brin_in_test_1 WHERE a < ANY (ARRAY[NULL, NULL]::int[]);
                           QUERY PLAN                           
----------------------------------------------------------------
 Aggregate
   ->  Bitmap Heap Scan on brin_in_test_1
         Recheck Cond: (a < ANY ('{NULL,NULL}'::integer[]))
         ->  Bitmap Index Scan on brin_in_test_1_idx_1
               Index Cond: (a < ANY ('{NULL,NULL}'::integer[]))
(5 rows)

SELECT COUNT(*) FROM brin_in_test_1 WHERE a < ANY (ARRAY[NULL, NULL]::int[]);
 count 
-------
     0
(1 row)

EXPLAIN (COSTS OFF)
SELECT COUNT(*) FROM brin_in_test_1 WHERE a < ANY (ARRAY[35, 29]);
                         QUERY PLAN                         
------------------------------------------------------------
 Aggregate
   ->  Bitmap Heap Scan on brin_in_test_1
         Recheck Cond: (a < ANY ('{35,29}'::integer[]))
         ->  Bitmap Index Scan on brin_in_test_1_idx_1
               Index Cond: (a < ANY ('{35,29}'::integer[]))
(5 rows)

SELECT COUNT(*) FROM brin_in_test_1 WHERE a < ANY (ARRAY[35, 29]);
 count 
-------
   127
(1 row)

EXPLAIN (COSTS OFF)
SELECT COUNT(*) FROM brin_in_test_1 WHERE a <= ANY (ARRAY[45, 60, NULL]);
                            QUERY PLAN                            
------------------------------------------------------------------
 Aggregate
   ->  Bitmap Heap Scan on brin_in_test_1
         Recheck Cond: (a <= ANY ('{45,60,NULL}'::integer[]))
         ->  Bitmap Index Scan on brin_in_test_1_idx_1
               Index Cond: (a <= ANY ('{45,60,NULL}'::integer[]))
(5 rows)

SELECT COUNT(*) FROM brin_in_test_1 WHERE a <= ANY (ARRAY[45, 60, NULL]);
 count 
-------
   255
(1 row)

EXPLAIN (COSTS OFF)
SELECT COUNT(*) FROM brin_in_test_1 WHERE a < ANY (ARRAY[41, 37, 55]);
                          QUERY PLAN                           
---------------------------------------------------------------
 Aggregate
   ->  Bitmap Heap Scan on brin_in_test_1
         Recheck Cond: (a < ANY ('{41,37,55}'::integer[]))
         ->  Bitmap Index Scan on brin_in_test_1_idx_1
               Index Cond: (a < ANY ('{41,37,55}'::integer[]))
(5 rows)

SELECT COUNT(*) FROM brin_in_test_1 WHERE a < ANY (ARRAY[41, 37, 55]);
 count 
-------
   227
(1 row)

EXPLAIN (COSTS OFF)
SELECT COUNT(*) FROM brin_in_test_1 WHERE a <= ANY (ARRAY[NULL, 60, 43, 94]);
                             QUERY PLAN                              
---------------------------------------------------------------------
 Aggregate
   ->  Bitmap Heap Scan on brin_in_test_1
         Recheck Cond: (a <= ANY ('{NULL,60,43,94}'::integer[]))
         ->  Bitmap Index Scan on brin_in_test_1_idx_1
               Index Cond: (a <= ANY ('{NULL,60,43,94}'::integer[]))
(5 rows)

SELECT COUNT(*) FROM brin_in_test_1 WHERE a <= ANY (ARRAY[NULL, 60, 43, 94]);
 count 
-------
   427
(1 row)

-- int: greater than
EXPLAIN (COSTS OFF)
SELECT COUNT(*) FROM brin_in_test_1 WHERE a > ANY (ARRAY[200]);
                        QUERY PLAN                        
----------------------------------------------------------
 Aggregate
   ->  Bitmap Heap Scan on brin_in_test_1
         Recheck Cond: (a > ANY ('{200}'::integer[]))
         ->  Bitmap Index Scan on brin_in_test_1_idx_1
               Index Cond: (a > ANY ('{200}'::integer[]))
(5 rows)

SELECT COUNT(*) FROM brin_in_test_1 WHERE a > ANY (ARRAY[200]);
 count 
-------
    45
(1 row)

EXPLAIN (COSTS OFF)
SELECT COUNT(*) FROM brin_in_test_1 WHERE a > ANY (ARRAY[177, NULL]);
                          QUERY PLAN                           
---------------------------------------------------------------
 Aggregate
   ->  Bitmap Heap Scan on brin_in_test_1
         Recheck Cond: (a > ANY ('{177,NULL}'::integer[]))
         ->  Bitmap Index Scan on brin_in_test_1_idx_1
               Index Cond: (a > ANY ('{177,NULL}'::integer[]))
(5 rows)

SELECT COUNT(*) FROM brin_in_test_1 WHERE a > ANY (ARRAY[177, NULL]);
 count 
-------
   157
(1 row)

EXPLAIN (COSTS OFF)
SELECT COUNT(*) FROM brin_in_test_1 WHERE a > ANY (ARRAY[NULL, NULL]::int[]);
                           QUERY PLAN                           
----------------------------------------------------------------
 Aggregate
   ->  Bitmap Heap Scan on brin_in_test_1
         Recheck Cond: (a > ANY ('{NULL,NULL}'::integer[]))
         ->  Bitmap Index Scan on brin_in_test_1_idx_1
               Index Cond: (a > ANY ('{NULL,NULL}'::integer[]))
(5 rows)

SELECT COUNT(*) FROM brin_in_test_1 WHERE a > ANY (ARRAY[NULL, NULL]::int[]);
 count 
-------
     0
(1 row)

EXPLAIN (COSTS OFF)
SELECT COUNT(*) FROM brin_in_test_1 WHERE a > ANY (ARRAY[153, 140]);
                          QUERY PLAN                          
--------------------------------------------------------------
 Aggregate
   ->  Bitmap Heap Scan on brin_in_test_1
         Recheck Cond: (a > ANY ('{153,140}'::integer[]))
         ->  Bitmap Index Scan on brin_in_test_1_idx_1
               Index Cond: (a > ANY ('{153,140}'::integer[]))
(5 rows)

SELECT COUNT(*) FROM brin_in_test_1 WHERE a > ANY (ARRAY[153, 140]);
 count 
-------
   345
(1 row)

EXPLAIN (COSTS OFF)
SELECT COUNT(*) FROM brin_in_test_1 WHERE a >= ANY (ARRAY[173, 191, NULL]);
                             QUERY PLAN                             
--------------------------------------------------------------------
 Aggregate
   ->  Bitmap Heap Scan on brin_in_test_1
         Recheck Cond: (a >= ANY ('{173,191,NULL}'::integer[]))
         ->  Bitmap Index Scan on brin_in_test_1_idx_1
               Index Cond: (a >= ANY ('{173,191,NULL}'::integer[]))
(5 rows)

SELECT COUNT(*) FROM brin_in_test_1 WHERE a >= ANY (ARRAY[173, 191, NULL]);
 count 
-------
   185
(1 row)

EXPLAIN (COSTS OFF)
SELECT COUNT(*) FROM brin_in_test_1 WHERE a > ANY (ARRAY[120, 184, 164]);
                            QUERY PLAN                            
------------------------------------------------------------------
 Aggregate
   ->  Bitmap Heap Scan on brin_in_test_1
         Recheck Cond: (a > ANY ('{120,184,164}'::integer[]))
         ->  Bitmap Index Scan on brin_in_test_1_idx_1
               Index Cond: (a > ANY ('{120,184,164}'::integer[]))
(5 rows)

SELECT COUNT(*) FROM brin_in_test_1 WHERE a > ANY (ARRAY[120, 184, 164]);
 count 
-------
   445
(1 row)

EXPLAIN (COSTS OFF)
SELECT COUNT(*) FROM brin_in_test_1 WHERE a >= ANY (ARRAY[NULL, 130, 181, 169]);
                               QUERY PLAN                               
------------------------------------------------------------------------
 Aggregate
   ->  Bitmap Heap Scan on brin_in_test_1
         Recheck Cond: (a >= ANY ('{NULL,130,181,169}'::integer[]))
         ->  Bitmap Index Scan on brin_in_test_1_idx_1
               Index Cond: (a >= ANY ('{NULL,130,181,169}'::integer[]))
(5 rows)

SELECT COUNT(*) FROM brin_in_test_1 WHERE a >= ANY (ARRAY[NULL, 130, 181, 169]);
 count 
-------
   397
(1 row)

-- bigint: eqalities
EXPLAIN (COSTS OFF)
SELECT COUNT(*) FROM brin_in_test_1 WHERE b IN (82);
                      QUERY PLAN                       
-------------------------------------------------------
 Aggregate
   ->  Bitmap Heap Scan on brin_in_test_1
         Recheck Cond: (b = 82)
         ->  Bitmap Index Scan on brin_in_test_1_idx_2
               Index Cond: (b = 82)
(5 rows)

SELECT COUNT(*) FROM brin_in_test_1 WHERE b IN (82);
 count 
-------
    10
(1 row)

EXPLAIN (COSTS OFF)
SELECT COUNT(*) FROM brin_in_test_1 WHERE b IN (82, NULL);
                         QUERY PLAN                          
-------------------------------------------------------------
 Aggregate
   ->  Bitmap Heap Scan on brin_in_test_1
         Recheck Cond: (b = ANY ('{82,NULL}'::bigint[]))
         ->  Bitmap Index Scan on brin_in_test_1_idx_2
               Index Cond: (b = ANY ('{82,NULL}'::bigint[]))
(5 rows)

SELECT COUNT(*) FROM brin_in_test_1 WHERE b IN (82, NULL);
 count 
-------
    10
(1 row)

EXPLAIN (COSTS OFF)
SELECT COUNT(*) FROM brin_in_test_1 WHERE b IN (NULL, NULL);
                          QUERY PLAN                           
---------------------------------------------------------------
 Aggregate
   ->  Bitmap Heap Scan on brin_in_test_1
         Recheck Cond: (b = ANY ('{NULL,NULL}'::bigint[]))
         ->  Bitmap Index Scan on brin_in_test_1_idx_2
               Index Cond: (b = ANY ('{NULL,NULL}'::bigint[]))
(5 rows)

SELECT COUNT(*) FROM brin_in_test_1 WHERE b IN (NULL, NULL);
 count 
-------
     0
(1 row)

EXPLAIN (COSTS OFF)
SELECT COUNT(*) FROM brin_in_test_1 WHERE b IN (82, 41);
                        QUERY PLAN                         
-----------------------------------------------------------
 Aggregate
   ->  Bitmap Heap Scan on brin_in_test_1
         Recheck Cond: (b = ANY ('{82,41}'::bigint[]))
         ->  Bitmap Index Scan on brin_in_test_1_idx_2
               Index Cond: (b = ANY ('{82,41}'::bigint[]))
(5 rows)

SELECT COUNT(*) FROM brin_in_test_1 WHERE b IN (82, 41);
 count 
-------
    20
(1 row)

EXPLAIN (COSTS OFF)
SELECT COUNT(*) FROM brin_in_test_1 WHERE b IN (82, 41, NULL);
                           QUERY PLAN                           
----------------------------------------------------------------
 Aggregate
   ->  Bitmap Heap Scan on brin_in_test_1
         Recheck Cond: (b = ANY ('{82,41,NULL}'::bigint[]))
         ->  Bitmap Index Scan on brin_in_test_1_idx_2
               Index Cond: (b = ANY ('{82,41,NULL}'::bigint[]))
(5 rows)

SELECT COUNT(*) FROM brin_in_test_1 WHERE b IN (82, 41, NULL);
 count 
-------
    20
(1 row)

EXPLAIN (COSTS OFF)
SELECT COUNT(*) FROM brin_in_test_1 WHERE b IN (82, 41, 15);
                          QUERY PLAN                          
--------------------------------------------------------------
 Aggregate
   ->  Bitmap Heap Scan on brin_in_test_1
         Recheck Cond: (b = ANY ('{82,41,15}'::bigint[]))
         ->  Bitmap Index Scan on brin_in_test_1_idx_2
               Index Cond: (b = ANY ('{82,41,15}'::bigint[]))
(5 rows)

SELECT COUNT(*) FROM brin_in_test_1 WHERE b IN (82, 41, 15);
 count 
-------
    25
(1 row)

EXPLAIN (COSTS OFF)
SELECT COUNT(*) FROM brin_in_test_1 WHERE b IN (NULL, 82, 41, 15);
                            QUERY PLAN                             
-------------------------------------------------------------------
 Aggregate
   ->  Bitmap Heap Scan on brin_in_test_1
         Recheck Cond: (b = ANY ('{NULL,82,41,15}'::bigint[]))
         ->  Bitmap Index Scan on brin_in_test_1_idx_2
               Index Cond: (b = ANY ('{NULL,82,41,15}'::bigint[]))
(5 rows)

SELECT COUNT(*) FROM brin_in_test_1 WHERE b IN (NULL, 82, 41, 15);
 count 
-------
    25
(1 row)

-- bigint: less than
EXPLAIN (COSTS OFF)
SELECT COUNT(*) FROM brin_in_test_1 WHERE b < ANY (ARRAY[31]);
                       QUERY PLAN                        
---------------------------------------------------------
 Aggregate
   ->  Bitmap Heap Scan on brin_in_test_1
         Recheck Cond: (b < ANY ('{31}'::integer[]))
         ->  Bitmap Index Scan on brin_in_test_1_idx_2
               Index Cond: (b < ANY ('{31}'::integer[]))
(5 rows)

SELECT COUNT(*) FROM brin_in_test_1 WHERE b < ANY (ARRAY[31]);
 count 
-------
   164
(1 row)

EXPLAIN (COSTS OFF)
SELECT COUNT(*) FROM brin_in_test_1 WHERE b < ANY (ARRAY[55, NULL]);
                          QUERY PLAN                          
--------------------------------------------------------------
 Aggregate
   ->  Bitmap Heap Scan on brin_in_test_1
         Recheck Cond: (b < ANY ('{55,NULL}'::integer[]))
         ->  Bitmap Index Scan on brin_in_test_1_idx_2
               Index Cond: (b < ANY ('{55,NULL}'::integer[]))
(5 rows)

SELECT COUNT(*) FROM brin_in_test_1 WHERE b < ANY (ARRAY[55, NULL]);
 count 
-------
   404
(1 row)

EXPLAIN (COSTS OFF)
SELECT COUNT(*) FROM brin_in_test_1 WHERE b < ANY (ARRAY[NULL, NULL]::bigint[]);
                          QUERY PLAN                           
---------------------------------------------------------------
 Aggregate
   ->  Bitmap Heap Scan on brin_in_test_1
         Recheck Cond: (b < ANY ('{NULL,NULL}'::bigint[]))
         ->  Bitmap Index Scan on brin_in_test_1_idx_2
               Index Cond: (b < ANY ('{NULL,NULL}'::bigint[]))
(5 rows)

SELECT COUNT(*) FROM brin_in_test_1 WHERE b < ANY (ARRAY[NULL, NULL]::bigint[]);
 count 
-------
     0
(1 row)

EXPLAIN (COSTS OFF)
SELECT COUNT(*) FROM brin_in_test_1 WHERE b <= ANY (ARRAY[73, 51]);
                         QUERY PLAN                          
-------------------------------------------------------------
 Aggregate
   ->  Bitmap Heap Scan on brin_in_test_1
         Recheck Cond: (b <= ANY ('{73,51}'::integer[]))
         ->  Bitmap Index Scan on brin_in_test_1_idx_2
               Index Cond: (b <= ANY ('{73,51}'::integer[]))
(5 rows)

SELECT COUNT(*) FROM brin_in_test_1 WHERE b <= ANY (ARRAY[73, 51]);
 count 
-------
   594
(1 row)

EXPLAIN (COSTS OFF)
SELECT COUNT(*) FROM brin_in_test_1 WHERE b < ANY (ARRAY[69, 87, NULL]);
                           QUERY PLAN                            
-----------------------------------------------------------------
 Aggregate
   ->  Bitmap Heap Scan on brin_in_test_1
         Recheck Cond: (b < ANY ('{69,87,NULL}'::integer[]))
         ->  Bitmap Index Scan on brin_in_test_1_idx_2
               Index Cond: (b < ANY ('{69,87,NULL}'::integer[]))
(5 rows)

SELECT COUNT(*) FROM brin_in_test_1 WHERE b < ANY (ARRAY[69, 87, NULL]);
 count 
-------
   724
(1 row)

EXPLAIN (COSTS OFF)
SELECT COUNT(*) FROM brin_in_test_1 WHERE b <= ANY (ARRAY[82, 91, 35]);
                           QUERY PLAN                           
----------------------------------------------------------------
 Aggregate
   ->  Bitmap Heap Scan on brin_in_test_1
         Recheck Cond: (b <= ANY ('{82,91,35}'::integer[]))
         ->  Bitmap Index Scan on brin_in_test_1_idx_2
               Index Cond: (b <= ANY ('{82,91,35}'::integer[]))
(5 rows)

SELECT COUNT(*) FROM brin_in_test_1 WHERE b <= ANY (ARRAY[82, 91, 35]);
 count 
-------
   774
(1 row)

EXPLAIN (COSTS OFF)
SELECT COUNT(*) FROM brin_in_test_1 WHERE b < ANY (ARRAY[NULL, 63, 21, 85]);
                             QUERY PLAN                             
--------------------------------------------------------------------
 Aggregate
   ->  Bitmap Heap Scan on brin_in_test_1
         Recheck Cond: (b < ANY ('{NULL,63,21,85}'::integer[]))
         ->  Bitmap Index Scan on brin_in_test_1_idx_2
               Index Cond: (b < ANY ('{NULL,63,21,85}'::integer[]))
(5 rows)

SELECT COUNT(*) FROM brin_in_test_1 WHERE b < ANY (ARRAY[NULL, 63, 21, 85]);
 count 
-------
   704
(1 row)

-- bigint: greater than
EXPLAIN (COSTS OFF)
SELECT COUNT(*) FROM brin_in_test_1 WHERE b > ANY (ARRAY[94]);
                       QUERY PLAN                        
---------------------------------------------------------
 Aggregate
   ->  Bitmap Heap Scan on brin_in_test_1
         Recheck Cond: (b > ANY ('{94}'::integer[]))
         ->  Bitmap Index Scan on brin_in_test_1_idx_2
               Index Cond: (b > ANY ('{94}'::integer[]))
(5 rows)

SELECT COUNT(*) FROM brin_in_test_1 WHERE b > ANY (ARRAY[94]);
 count 
-------
   196
(1 row)

EXPLAIN (COSTS OFF)
SELECT COUNT(*) FROM brin_in_test_1 WHERE b > ANY (ARRAY[80, NULL]);
                          QUERY PLAN                          
--------------------------------------------------------------
 Aggregate
   ->  Bitmap Heap Scan on brin_in_test_1
         Recheck Cond: (b > ANY ('{80,NULL}'::integer[]))
         ->  Bitmap Index Scan on brin_in_test_1_idx_2
               Index Cond: (b > ANY ('{80,NULL}'::integer[]))
(5 rows)

SELECT COUNT(*) FROM brin_in_test_1 WHERE b > ANY (ARRAY[80, NULL]);
 count 
-------
   336
(1 row)

EXPLAIN (COSTS OFF)
SELECT COUNT(*) FROM brin_in_test_1 WHERE b > ANY (ARRAY[NULL, NULL]::bigint[]);
                          QUERY PLAN                           
---------------------------------------------------------------
 Aggregate
   ->  Bitmap Heap Scan on brin_in_test_1
         Recheck Cond: (b > ANY ('{NULL,NULL}'::bigint[]))
         ->  Bitmap Index Scan on brin_in_test_1_idx_2
               Index Cond: (b > ANY ('{NULL,NULL}'::bigint[]))
(5 rows)

SELECT COUNT(*) FROM brin_in_test_1 WHERE b > ANY (ARRAY[NULL, NULL]::bigint[]);
 count 
-------
     0
(1 row)

EXPLAIN (COSTS OFF)
SELECT COUNT(*) FROM brin_in_test_1 WHERE b > ANY (ARRAY[199, 107]);
                          QUERY PLAN                          
--------------------------------------------------------------
 Aggregate
   ->  Bitmap Heap Scan on brin_in_test_1
         Recheck Cond: (b > ANY ('{199,107}'::integer[]))
         ->  Bitmap Index Scan on brin_in_test_1_idx_2
               Index Cond: (b > ANY ('{199,107}'::integer[]))
(5 rows)

SELECT COUNT(*) FROM brin_in_test_1 WHERE b > ANY (ARRAY[199, 107]);
 count 
-------
    78
(1 row)

EXPLAIN (COSTS OFF)
SELECT COUNT(*) FROM brin_in_test_1 WHERE b >= ANY (ARRAY[182, 101, NULL]);
                             QUERY PLAN                             
--------------------------------------------------------------------
 Aggregate
   ->  Bitmap Heap Scan on brin_in_test_1
         Recheck Cond: (b >= ANY ('{182,101,NULL}'::integer[]))
         ->  Bitmap Index Scan on brin_in_test_1_idx_2
               Index Cond: (b >= ANY ('{182,101,NULL}'::integer[]))
(5 rows)

SELECT COUNT(*) FROM brin_in_test_1 WHERE b >= ANY (ARRAY[182, 101, NULL]);
 count 
-------
   137
(1 row)

EXPLAIN (COSTS OFF)
SELECT COUNT(*) FROM brin_in_test_1 WHERE b > ANY (ARRAY[300, 106, 251]);
                            QUERY PLAN                            
------------------------------------------------------------------
 Aggregate
   ->  Bitmap Heap Scan on brin_in_test_1
         Recheck Cond: (b > ANY ('{300,106,251}'::integer[]))
         ->  Bitmap Index Scan on brin_in_test_1_idx_2
               Index Cond: (b > ANY ('{300,106,251}'::integer[]))
(5 rows)

SELECT COUNT(*) FROM brin_in_test_1 WHERE b > ANY (ARRAY[300, 106, 251]);
 count 
-------
    86
(1 row)

EXPLAIN (COSTS OFF)
SELECT COUNT(*) FROM brin_in_test_1 WHERE b > ANY (ARRAY[NULL, 182, 101, 155]);
                              QUERY PLAN                               
-----------------------------------------------------------------------
 Aggregate
   ->  Bitmap Heap Scan on brin_in_test_1
         Recheck Cond: (b > ANY ('{NULL,182,101,155}'::integer[]))
         ->  Bitmap Index Scan on brin_in_test_1_idx_2
               Index Cond: (b > ANY ('{NULL,182,101,155}'::integer[]))
(5 rows)

SELECT COUNT(*) FROM brin_in_test_1 WHERE b > ANY (ARRAY[NULL, 182, 101, 155]);
 count 
-------
   127
(1 row)

DROP TABLE brin_in_test_1;
RESET enable_seqscan;
-- do some tests on IN clauses for varlena data types
CREATE TABLE brin_in_test_2 (a TEXT) WITH (fillfactor=10);
INSERT INTO brin_in_test_2
SELECT v FROM (SELECT row_number() OVER (ORDER BY v) c, v FROM (SELECT md5((i/13)::text) AS v FROM generate_series(1,1000) s(i)) foo) bar ORDER BY c + 25 * random();
CREATE INDEX brin_in_test_2_idx ON brin_in_test_2 USING brin (a text_minmax_ops) WITH (pages_per_range=1);
SET enable_seqscan=off;
EXPLAIN (COSTS OFF)
SELECT COUNT(*) FROM brin_in_test_2 WHERE a IN ('33e75ff09dd601bbe69f351039152189');
                                QUERY PLAN                                
--------------------------------------------------------------------------
 Aggregate
   ->  Bitmap Heap Scan on brin_in_test_2
         Recheck Cond: (a = '33e75ff09dd601bbe69f351039152189'::text)
         ->  Bitmap Index Scan on brin_in_test_2_idx
               Index Cond: (a = '33e75ff09dd601bbe69f351039152189'::text)
(5 rows)

SELECT COUNT(*) FROM brin_in_test_2 WHERE a IN ('33e75ff09dd601bbe69f351039152189');
 count 
-------
    13
(1 row)

EXPLAIN (COSTS OFF)
SELECT COUNT(*) FROM brin_in_test_2 WHERE a IN ('33e75ff09dd601bbe69f351039152189', NULL);
                                       QUERY PLAN                                        
-----------------------------------------------------------------------------------------
 Aggregate
   ->  Bitmap Heap Scan on brin_in_test_2
         Recheck Cond: (a = ANY ('{33e75ff09dd601bbe69f351039152189,NULL}'::text[]))
         ->  Bitmap Index Scan on brin_in_test_2_idx
               Index Cond: (a = ANY ('{33e75ff09dd601bbe69f351039152189,NULL}'::text[]))
(5 rows)

SELECT COUNT(*) FROM brin_in_test_2 WHERE a IN ('33e75ff09dd601bbe69f351039152189', NULL);
 count 
-------
    13
(1 row)

EXPLAIN (COSTS OFF)
SELECT COUNT(*) FROM brin_in_test_2 WHERE a IN (NULL, NULL);
                         QUERY PLAN                          
-------------------------------------------------------------
 Aggregate
   ->  Bitmap Heap Scan on brin_in_test_2
         Recheck Cond: (a = ANY ('{NULL,NULL}'::text[]))
         ->  Bitmap Index Scan on brin_in_test_2_idx
               Index Cond: (a = ANY ('{NULL,NULL}'::text[]))
(5 rows)

SELECT COUNT(*) FROM brin_in_test_2 WHERE a IN (NULL, NULL);
 count 
-------
     0
(1 row)

EXPLAIN (COSTS OFF)
SELECT COUNT(*) FROM brin_in_test_2 WHERE a IN ('33e75ff09dd601bbe69f351039152189', 'f457c545a9ded88f18ecee47145a72c0');
                                                     QUERY PLAN                                                      
---------------------------------------------------------------------------------------------------------------------
 Aggregate
   ->  Bitmap Heap Scan on brin_in_test_2
         Recheck Cond: (a = ANY ('{33e75ff09dd601bbe69f351039152189,f457c545a9ded88f18ecee47145a72c0}'::text[]))
         ->  Bitmap Index Scan on brin_in_test_2_idx
               Index Cond: (a = ANY ('{33e75ff09dd601bbe69f351039152189,f457c545a9ded88f18ecee47145a72c0}'::text[]))
(5 rows)

SELECT COUNT(*) FROM brin_in_test_2 WHERE a IN ('33e75ff09dd601bbe69f351039152189', 'f457c545a9ded88f18ecee47145a72c0');
 count 
-------
    26
(1 row)

EXPLAIN (COSTS OFF)
SELECT COUNT(*) FROM brin_in_test_2 WHERE a IN ('33e75ff09dd601bbe69f351039152189', 'f457c545a9ded88f18ecee47145a72c0', NULL);
                                                        QUERY PLAN                                                        
--------------------------------------------------------------------------------------------------------------------------
 Aggregate
   ->  Bitmap Heap Scan on brin_in_test_2
         Recheck Cond: (a = ANY ('{33e75ff09dd601bbe69f351039152189,f457c545a9ded88f18ecee47145a72c0,NULL}'::text[]))
         ->  Bitmap Index Scan on brin_in_test_2_idx
               Index Cond: (a = ANY ('{33e75ff09dd601bbe69f351039152189,f457c545a9ded88f18ecee47145a72c0,NULL}'::text[]))
(5 rows)

SELECT COUNT(*) FROM brin_in_test_2 WHERE a IN ('33e75ff09dd601bbe69f351039152189', 'f457c545a9ded88f18ecee47145a72c0', NULL);
 count 
-------
    26
(1 row)

EXPLAIN (COSTS OFF)
SELECT COUNT(*) FROM brin_in_test_2 WHERE a IN ('33e75ff09dd601bbe69f351039152189', 'f457c545a9ded88f18ecee47145a72c0', 'c51ce410c124a10e0db5e4b97fc2af39');
                                                                      QUERY PLAN                                                                      
------------------------------------------------------------------------------------------------------------------------------------------------------
 Aggregate
   ->  Bitmap Heap Scan on brin_in_test_2
         Recheck Cond: (a = ANY ('{33e75ff09dd601bbe69f351039152189,f457c545a9ded88f18ecee47145a72c0,c51ce410c124a10e0db5e4b97fc2af39}'::text[]))
         ->  Bitmap Index Scan on brin_in_test_2_idx
               Index Cond: (a = ANY ('{33e75ff09dd601bbe69f351039152189,f457c545a9ded88f18ecee47145a72c0,c51ce410c124a10e0db5e4b97fc2af39}'::text[]))
(5 rows)

SELECT COUNT(*) FROM brin_in_test_2 WHERE a IN ('33e75ff09dd601bbe69f351039152189', 'f457c545a9ded88f18ecee47145a72c0', 'c51ce410c124a10e0db5e4b97fc2af39');
 count 
-------
    39
(1 row)

EXPLAIN (COSTS OFF)
SELECT COUNT(*) FROM brin_in_test_2 WHERE a IN (NULL, '33e75ff09dd601bbe69f351039152189', 'f457c545a9ded88f18ecee47145a72c0', 'c51ce410c124a10e0db5e4b97fc2af39');
                                                                        QUERY PLAN                                                                         
-----------------------------------------------------------------------------------------------------------------------------------------------------------
 Aggregate
   ->  Bitmap Heap Scan on brin_in_test_2
         Recheck Cond: (a = ANY ('{NULL,33e75ff09dd601bbe69f351039152189,f457c545a9ded88f18ecee47145a72c0,c51ce410c124a10e0db5e4b97fc2af39}'::text[]))
         ->  Bitmap Index Scan on brin_in_test_2_idx
               Index Cond: (a = ANY ('{NULL,33e75ff09dd601bbe69f351039152189,f457c545a9ded88f18ecee47145a72c0,c51ce410c124a10e0db5e4b97fc2af39}'::text[]))
(5 rows)

SELECT COUNT(*) FROM brin_in_test_2 WHERE a IN (NULL, '33e75ff09dd601bbe69f351039152189', 'f457c545a9ded88f18ecee47145a72c0', 'c51ce410c124a10e0db5e4b97fc2af39');
 count 
-------
    39
(1 row)

DROP TABLE brin_in_test_2;
RESET enable_seqscan;
-- do some tests on IN clauses for boxes and points
CREATE TABLE brin_in_test_3 (a BOX) WITH (fillfactor=10);
INSERT INTO brin_in_test_3
SELECT format('((%s,%s), (%s,%s))', x - mod(i,17), y - mod(i,13), x + mod(i,19), y + mod(i,11))::box FROM (
  SELECT i,
         i/10 + mod(991 * i + 617, 20) AS x,
         i/10 + mod(853 * i + 491, 30) AS y
    FROM generate_series(1,1000) s(i)
) foo;
CREATE INDEX brin_in_test_3_idx ON brin_in_test_3 USING brin (a box_inclusion_ops) WITH (pages_per_range=1);
SET enable_seqscan=off;
EXPLAIN (COSTS OFF)
SELECT COUNT(*) FROM brin_in_test_3 WHERE a @> ANY (ARRAY['(10,10)'::point]);
                          QUERY PLAN                           
---------------------------------------------------------------
 Aggregate
   ->  Bitmap Heap Scan on brin_in_test_3
         Recheck Cond: (a @> ANY ('{"(10,10)"}'::point[]))
         ->  Bitmap Index Scan on brin_in_test_3_idx
               Index Cond: (a @> ANY ('{"(10,10)"}'::point[]))
(5 rows)

SELECT COUNT(*) FROM brin_in_test_3 WHERE a @> ANY (ARRAY['(10,10)'::point]);
 count 
-------
    26
(1 row)

EXPLAIN (COSTS OFF)
SELECT COUNT(*) FROM brin_in_test_3 WHERE a @> ANY (ARRAY['(10,10)'::point, NULL]);
                             QUERY PLAN                             
--------------------------------------------------------------------
 Aggregate
   ->  Bitmap Heap Scan on brin_in_test_3
         Recheck Cond: (a @> ANY ('{"(10,10)",NULL}'::point[]))
         ->  Bitmap Index Scan on brin_in_test_3_idx
               Index Cond: (a @> ANY ('{"(10,10)",NULL}'::point[]))
(5 rows)

SELECT COUNT(*) FROM brin_in_test_3 WHERE a @> ANY (ARRAY['(10,10)'::point, NULL]);
 count 
-------
    26
(1 row)

EXPLAIN (COSTS OFF)
SELECT COUNT(*) FROM brin_in_test_3 WHERE a @> ANY (ARRAY[NULL::point, NULL::point]);
                          QUERY PLAN                           
---------------------------------------------------------------
 Aggregate
   ->  Bitmap Heap Scan on brin_in_test_3
         Recheck Cond: (a @> ANY ('{NULL,NULL}'::point[]))
         ->  Bitmap Index Scan on brin_in_test_3_idx
               Index Cond: (a @> ANY ('{NULL,NULL}'::point[]))
(5 rows)

SELECT COUNT(*) FROM brin_in_test_3 WHERE a @> ANY (ARRAY[NULL::point, NULL::point]);
 count 
-------
     0
(1 row)

EXPLAIN (COSTS OFF)
SELECT COUNT(*) FROM brin_in_test_3 WHERE a @> ANY (ARRAY['(10,10)'::point, '(50,50)'::point]);
                               QUERY PLAN                                
-------------------------------------------------------------------------
 Aggregate
   ->  Bitmap Heap Scan on brin_in_test_3
         Recheck Cond: (a @> ANY ('{"(10,10)","(50,50)"}'::point[]))
         ->  Bitmap Index Scan on brin_in_test_3_idx
               Index Cond: (a @> ANY ('{"(10,10)","(50,50)"}'::point[]))
(5 rows)

SELECT COUNT(*) FROM brin_in_test_3 WHERE a @> ANY (ARRAY['(10,10)'::point, '(50,50)'::point]);
 count 
-------
    80
(1 row)

EXPLAIN (COSTS OFF)
SELECT COUNT(*) FROM brin_in_test_3 WHERE a @> ANY (ARRAY['(10,10)'::point, '(50,50)'::point, NULL]);
                                  QUERY PLAN                                  
------------------------------------------------------------------------------
 Aggregate
   ->  Bitmap Heap Scan on brin_in_test_3
         Recheck Cond: (a @> ANY ('{"(10,10)","(50,50)",NULL}'::point[]))
         ->  Bitmap Index Scan on brin_in_test_3_idx
               Index Cond: (a @> ANY ('{"(10,10)","(50,50)",NULL}'::point[]))
(5 rows)

SELECT COUNT(*) FROM brin_in_test_3 WHERE a @> ANY (ARRAY['(10,10)'::point, '(50,50)'::point, NULL]);
 count 
-------
    80
(1 row)

EXPLAIN (COSTS OFF)
SELECT COUNT(*) FROM brin_in_test_3 WHERE a @> ANY (ARRAY['(10,10)'::point, '(50,50)'::point, '(25,25)'::point]);
                                    QUERY PLAN                                     
-----------------------------------------------------------------------------------
 Aggregate
   ->  Bitmap Heap Scan on brin_in_test_3
         Recheck Cond: (a @> ANY ('{"(10,10)","(50,50)","(25,25)"}'::point[]))
         ->  Bitmap Index Scan on brin_in_test_3_idx
               Index Cond: (a @> ANY ('{"(10,10)","(50,50)","(25,25)"}'::point[]))
(5 rows)

SELECT COUNT(*) FROM brin_in_test_3 WHERE a @> ANY (ARRAY['(10,10)'::point, '(50,50)'::point, '(25,25)'::point]);
 count 
-------
   129
(1 row)

EXPLAIN (COSTS OFF)
SELECT COUNT(*) FROM brin_in_test_3 WHERE a @> ANY (ARRAY[NULL, '(10,10)'::point, '(50,50)'::point, '(25,25)'::point]);
                                       QUERY PLAN                                       
----------------------------------------------------------------------------------------
 Aggregate
   ->  Bitmap Heap Scan on brin_in_test_3
         Recheck Cond: (a @> ANY ('{NULL,"(10,10)","(50,50)","(25,25)"}'::point[]))
         ->  Bitmap Index Scan on brin_in_test_3_idx
               Index Cond: (a @> ANY ('{NULL,"(10,10)","(50,50)","(25,25)"}'::point[]))
(5 rows)

SELECT COUNT(*) FROM brin_in_test_3 WHERE a @> ANY (ARRAY[NULL, '(10,10)'::point, '(50,50)'::point, '(25,25)'::point]);
 count 
-------
   129
(1 row)

DROP TABLE brin_in_test_3;
RESET enable_seqscan;
