--
-- BTREE_INDEX
--
-- directory paths are passed to us in environment variables
\getenv abs_srcdir PG_ABS_SRCDIR
CREATE TABLE bt_i4_heap (
	seqno 		int4,
	random 		int4
);
CREATE TABLE bt_name_heap (
	seqno 		name,
	random 		int4
);
CREATE TABLE bt_txt_heap (
	seqno 		text,
	random 		int4
);
CREATE TABLE bt_f8_heap (
	seqno 		float8,
	random 		int4
);
\set filename :abs_srcdir '/data/desc.data'
COPY bt_i4_heap FROM :'filename';
\set filename :abs_srcdir '/data/hash.data'
COPY bt_name_heap FROM :'filename';
\set filename :abs_srcdir '/data/desc.data'
COPY bt_txt_heap FROM :'filename';
\set filename :abs_srcdir '/data/hash.data'
COPY bt_f8_heap FROM :'filename';
ANALYZE bt_i4_heap;
ANALYZE bt_name_heap;
ANALYZE bt_txt_heap;
ANALYZE bt_f8_heap;
--
-- BTREE ascending/descending cases
--
-- we load int4/text from pure descending data (each key is a new
-- low key) and name/f8 from pure ascending data (each key is a new
-- high key).  we had a bug where new low keys would sometimes be
-- "lost".
--
CREATE INDEX bt_i4_index ON bt_i4_heap USING btree (seqno int4_ops);
CREATE INDEX bt_name_index ON bt_name_heap USING btree (seqno name_ops);
CREATE INDEX bt_txt_index ON bt_txt_heap USING btree (seqno text_ops);
CREATE INDEX bt_f8_index ON bt_f8_heap USING btree (seqno float8_ops);
--
-- test retrieval of min/max keys for each index
--
SELECT b.*
   FROM bt_i4_heap b
   WHERE b.seqno < 1;
 seqno |   random   
-------+------------
     0 | 1935401906
(1 row)

SELECT b.*
   FROM bt_i4_heap b
   WHERE b.seqno >= 9999;
 seqno |   random   
-------+------------
  9999 | 1227676208
(1 row)

SELECT b.*
   FROM bt_i4_heap b
   WHERE b.seqno = 4500;
 seqno |   random   
-------+------------
  4500 | 2080851358
(1 row)

SELECT b.*
   FROM bt_name_heap b
   WHERE b.seqno < '1'::name;
 seqno |   random   
-------+------------
 0     | 1935401906
(1 row)

SELECT b.*
   FROM bt_name_heap b
   WHERE b.seqno >= '9999'::name;
 seqno |   random   
-------+------------
 9999  | 1227676208
(1 row)

SELECT b.*
   FROM bt_name_heap b
   WHERE b.seqno = '4500'::name;
 seqno |   random   
-------+------------
 4500  | 2080851358
(1 row)

SELECT b.*
   FROM bt_txt_heap b
   WHERE b.seqno < '1'::text;
 seqno |   random   
-------+------------
 0     | 1935401906
(1 row)

SELECT b.*
   FROM bt_txt_heap b
   WHERE b.seqno >= '9999'::text;
 seqno |   random   
-------+------------
 9999  | 1227676208
(1 row)

SELECT b.*
   FROM bt_txt_heap b
   WHERE b.seqno = '4500'::text;
 seqno |   random   
-------+------------
 4500  | 2080851358
(1 row)

SELECT b.*
   FROM bt_f8_heap b
   WHERE b.seqno < '1'::float8;
 seqno |   random   
-------+------------
     0 | 1935401906
(1 row)

SELECT b.*
   FROM bt_f8_heap b
   WHERE b.seqno >= '9999'::float8;
 seqno |   random   
-------+------------
  9999 | 1227676208
(1 row)

SELECT b.*
   FROM bt_f8_heap b
   WHERE b.seqno = '4500'::float8;
 seqno |   random   
-------+------------
  4500 | 2080851358
(1 row)

--
-- Add coverage of RowCompare quals whose row omits a column ("proargtypes")
-- that's after the first column, but before the final column.  The scan's
-- initial positioning strategy must become >= here (it's not the > strategy,
-- since the absence of "proargtypes" makes that tighter constraint unsafe).
--
explain (costs off)
SELECT proname, proargtypes, pronamespace
   FROM pg_proc
   WHERE (proname, pronamespace) > ('abs', 0)
ORDER BY proname, proargtypes, pronamespace LIMIT 1;
                                  QUERY PLAN                                   
-------------------------------------------------------------------------------
 Limit
   ->  Index Only Scan using pg_proc_proname_args_nsp_index on pg_proc
         Index Cond: (ROW(proname, pronamespace) > ROW('abs'::name, '0'::oid))
(3 rows)

SELECT proname, proargtypes, pronamespace
   FROM pg_proc
   WHERE (proname, pronamespace) > ('abs', 0)
ORDER BY proname, proargtypes, pronamespace LIMIT 1;
 proname | proargtypes | pronamespace 
---------+-------------+--------------
 abs     | 20          |           11
(1 row)

--
-- Similar to the previous test case, but this time it's a backwards scan
-- using a < RowCompare.  Must use the <= strategy (and not the < strategy).
--
explain (costs off)
SELECT proname, proargtypes, pronamespace
   FROM pg_proc
   WHERE (proname, pronamespace) < ('abs', 1_000_000)
ORDER BY proname DESC, proargtypes DESC, pronamespace DESC LIMIT 1;
                                     QUERY PLAN                                      
-------------------------------------------------------------------------------------
 Limit
   ->  Index Only Scan Backward using pg_proc_proname_args_nsp_index on pg_proc
         Index Cond: (ROW(proname, pronamespace) < ROW('abs'::name, '1000000'::oid))
(3 rows)

SELECT proname, proargtypes, pronamespace
   FROM pg_proc
   WHERE (proname, pronamespace) < ('abs', 1_000_000)
ORDER BY proname DESC, proargtypes DESC, pronamespace DESC LIMIT 1;
 proname | proargtypes | pronamespace 
---------+-------------+--------------
 abs     | 1700        |           11
(1 row)

--
-- Forwards scan RowCompare qual whose row arg has a NULL that affects our
-- initial positioning strategy
--
explain (costs off)
SELECT proname, proargtypes, pronamespace
   FROM pg_proc
   WHERE (proname, proargtypes) >= ('abs', NULL) AND proname <= 'abs'
ORDER BY proname, proargtypes, pronamespace;
                                                  QUERY PLAN                                                   
---------------------------------------------------------------------------------------------------------------
 Index Only Scan using pg_proc_proname_args_nsp_index on pg_proc
   Index Cond: ((ROW(proname, proargtypes) >= ROW('abs'::name, NULL::oidvector)) AND (proname <= 'abs'::name))
(2 rows)

SELECT proname, proargtypes, pronamespace
   FROM pg_proc
   WHERE (proname, proargtypes) >= ('abs', NULL) AND proname <= 'abs'
ORDER BY proname, proargtypes, pronamespace;
 proname | proargtypes | pronamespace 
---------+-------------+--------------
(0 rows)

--
-- Forwards scan RowCompare quals whose row arg has a NULL that ends scan
--
explain (costs off)
SELECT proname, proargtypes, pronamespace
   FROM pg_proc
   WHERE proname >= 'abs' AND (proname, proargtypes) < ('abs', NULL)
ORDER BY proname, proargtypes, pronamespace;
                                                  QUERY PLAN                                                  
--------------------------------------------------------------------------------------------------------------
 Index Only Scan using pg_proc_proname_args_nsp_index on pg_proc
   Index Cond: ((proname >= 'abs'::name) AND (ROW(proname, proargtypes) < ROW('abs'::name, NULL::oidvector)))
(2 rows)

SELECT proname, proargtypes, pronamespace
   FROM pg_proc
   WHERE proname >= 'abs' AND (proname, proargtypes) < ('abs', NULL)
ORDER BY proname, proargtypes, pronamespace;
 proname | proargtypes | pronamespace 
---------+-------------+--------------
(0 rows)

--
-- Backwards scan RowCompare qual whose row arg has a NULL that affects our
-- initial positioning strategy
--
explain (costs off)
SELECT proname, proargtypes, pronamespace
   FROM pg_proc
   WHERE proname >= 'abs' AND (proname, proargtypes) <= ('abs', NULL)
ORDER BY proname DESC, proargtypes DESC, pronamespace DESC;
                                                  QUERY PLAN                                                   
---------------------------------------------------------------------------------------------------------------
 Index Only Scan Backward using pg_proc_proname_args_nsp_index on pg_proc
   Index Cond: ((proname >= 'abs'::name) AND (ROW(proname, proargtypes) <= ROW('abs'::name, NULL::oidvector)))
(2 rows)

SELECT proname, proargtypes, pronamespace
   FROM pg_proc
   WHERE proname >= 'abs' AND (proname, proargtypes) <= ('abs', NULL)
ORDER BY proname DESC, proargtypes DESC, pronamespace DESC;
 proname | proargtypes | pronamespace 
---------+-------------+--------------
(0 rows)

--
-- Backwards scan RowCompare qual whose row arg has a NULL that ends scan
--
explain (costs off)
SELECT proname, proargtypes, pronamespace
   FROM pg_proc
   WHERE (proname, proargtypes) > ('abs', NULL) AND proname <= 'abs'
ORDER BY proname DESC, proargtypes DESC, pronamespace DESC;
                                                  QUERY PLAN                                                  
--------------------------------------------------------------------------------------------------------------
 Index Only Scan Backward using pg_proc_proname_args_nsp_index on pg_proc
   Index Cond: ((ROW(proname, proargtypes) > ROW('abs'::name, NULL::oidvector)) AND (proname <= 'abs'::name))
(2 rows)

SELECT proname, proargtypes, pronamespace
   FROM pg_proc
   WHERE (proname, proargtypes) > ('abs', NULL) AND proname <= 'abs'
ORDER BY proname DESC, proargtypes DESC, pronamespace DESC;
 proname | proargtypes | pronamespace 
---------+-------------+--------------
(0 rows)

-- Makes B-Tree preprocessing deal with unmarking redundant keys that were
-- initially marked required (test case relies on current row compare
-- preprocessing limitations)
explain (costs off)
SELECT proname, proargtypes, pronamespace
   FROM pg_proc
   WHERE proname = 'zzzzzz' AND (proname, proargtypes) > ('abs', NULL)
   AND pronamespace IN (1, 2, 3) AND proargtypes IN ('26 23', '5077')
ORDER BY proname, proargtypes, pronamespace;
                                                                                                     QUERY PLAN                                                                                                     
--------------------------------------------------------------------------------------------------------------------------------------------------------------------------------------------------------------------
 Index Only Scan using pg_proc_proname_args_nsp_index on pg_proc
   Index Cond: ((ROW(proname, proargtypes) > ROW('abs'::name, NULL::oidvector)) AND (proname = 'zzzzzz'::name) AND (proargtypes = ANY ('{"26 23",5077}'::oidvector[])) AND (pronamespace = ANY ('{1,2,3}'::oid[])))
(2 rows)

SELECT proname, proargtypes, pronamespace
   FROM pg_proc
   WHERE proname = 'zzzzzz' AND (proname, proargtypes) > ('abs', NULL)
   AND pronamespace IN (1, 2, 3) AND proargtypes IN ('26 23', '5077')
ORDER BY proname, proargtypes, pronamespace;
 proname | proargtypes | pronamespace 
---------+-------------+--------------
(0 rows)

--
-- Performs a recheck of > key following array advancement on previous (left
-- sibling) page that used a high key whose attribute value corresponding to
-- the > key was -inf (due to being truncated when the high key was created).
--
-- XXX This relies on the assumption that tenk1_thous_tenthous has a truncated
-- high key "(183, -inf)" on the first page that we'll scan.  The test will only
-- provide useful coverage when the default 8K BLCKSZ is in use.
--
explain (costs off)
SELECT thousand, tenthous
  FROM tenk1
  WHERE thousand IN (182, 183) AND tenthous > 7550;
                                   QUERY PLAN                                    
---------------------------------------------------------------------------------
 Index Only Scan using tenk1_thous_tenthous on tenk1
   Index Cond: ((thousand = ANY ('{182,183}'::integer[])) AND (tenthous > 7550))
(2 rows)

SELECT thousand, tenthous
  FROM tenk1
  WHERE thousand IN (182, 183) AND tenthous > 7550;
 thousand | tenthous 
----------+----------
      182 |     8182
      182 |     9182
      183 |     8183
      183 |     9183
(4 rows)

--
-- Add coverage for optimization of backwards scan index descents
--
-- Here we expect _bt_search to descend straight to a leaf page containing a
-- non-pivot tuple with the value '47', which comes last (after 11 similar
-- non-pivot tuples).  Query execution should only need to visit a single
-- leaf page here.
--
-- Test case relies on tenk1_hundred index having a leaf page whose high key
-- is '(48, -inf)'.  We use a low cardinality index to make our test case less
-- sensitive to implementation details that may change in the future.
set enable_seqscan to false;
set enable_indexscan to true;
set enable_bitmapscan to false;
explain (costs off)
select hundred, twenty from tenk1 where hundred < 48 order by hundred desc limit 1;
                       QUERY PLAN                       
--------------------------------------------------------
 Limit
   ->  Index Scan Backward using tenk1_hundred on tenk1
         Index Cond: (hundred < 48)
(3 rows)

select hundred, twenty from tenk1 where hundred < 48 order by hundred desc limit 1;
 hundred | twenty 
---------+--------
      47 |      7
(1 row)

-- This variant of the query need only return a single tuple located to the immediate
-- right of the '(48, -inf)' high key.  It also only needs to scan one single
-- leaf page (the right sibling of the page scanned by the last test case):
explain (costs off)
select hundred, twenty from tenk1 where hundred <= 48 order by hundred desc limit 1;
                       QUERY PLAN                       
--------------------------------------------------------
 Limit
   ->  Index Scan Backward using tenk1_hundred on tenk1
         Index Cond: (hundred <= 48)
(3 rows)

select hundred, twenty from tenk1 where hundred <= 48 order by hundred desc limit 1;
 hundred | twenty 
---------+--------
      48 |      8
(1 row)

--
-- Add coverage for ScalarArrayOp btree quals with pivot tuple constants
--
explain (costs off)
select distinct hundred from tenk1 where hundred in (47, 48, 72, 82);
                            QUERY PLAN                            
------------------------------------------------------------------
 Unique
   ->  Index Only Scan using tenk1_hundred on tenk1
         Index Cond: (hundred = ANY ('{47,48,72,82}'::integer[]))
(3 rows)

select distinct hundred from tenk1 where hundred in (47, 48, 72, 82);
 hundred 
---------
      47
      48
      72
      82
(4 rows)

explain (costs off)
select distinct hundred from tenk1 where hundred in (47, 48, 72, 82) order by hundred desc;
                            QUERY PLAN                            
------------------------------------------------------------------
 Unique
   ->  Index Only Scan Backward using tenk1_hundred on tenk1
         Index Cond: (hundred = ANY ('{47,48,72,82}'::integer[]))
(3 rows)

select distinct hundred from tenk1 where hundred in (47, 48, 72, 82) order by hundred desc;
 hundred 
---------
      82
      72
      48
      47
(4 rows)

explain (costs off)
select thousand from tenk1 where thousand in (364, 366,380) and tenthous = 200000;
                                      QUERY PLAN                                       
---------------------------------------------------------------------------------------
 Index Only Scan using tenk1_thous_tenthous on tenk1
   Index Cond: ((thousand = ANY ('{364,366,380}'::integer[])) AND (tenthous = 200000))
(2 rows)

select thousand from tenk1 where thousand in (364, 366,380) and tenthous = 200000;
 thousand 
----------
(0 rows)

--
-- Check correct optimization of LIKE (special index operator support)
-- for both indexscan and bitmapscan cases
--
set enable_seqscan to false;
set enable_indexscan to true;
set enable_bitmapscan to false;
explain (costs off)
select proname from pg_proc where proname like E'RI\\_FKey%del' order by 1;
                                  QUERY PLAN                                  
------------------------------------------------------------------------------
 Index Only Scan using pg_proc_proname_args_nsp_index on pg_proc
   Index Cond: ((proname >= 'RI_FKey'::text) AND (proname < 'RI_FKez'::text))
   Filter: (proname ~~ 'RI\_FKey%del'::text)
(3 rows)

select proname from pg_proc where proname like E'RI\\_FKey%del' order by 1;
        proname         
------------------------
 RI_FKey_cascade_del
 RI_FKey_noaction_del
 RI_FKey_restrict_del
 RI_FKey_setdefault_del
 RI_FKey_setnull_del
(5 rows)

explain (costs off)
select proname from pg_proc where proname ilike '00%foo' order by 1;
                             QUERY PLAN                             
--------------------------------------------------------------------
 Index Only Scan using pg_proc_proname_args_nsp_index on pg_proc
   Index Cond: ((proname >= '00'::text) AND (proname < '01'::text))
   Filter: (proname ~~* '00%foo'::text)
(3 rows)

select proname from pg_proc where proname ilike '00%foo' order by 1;
 proname 
---------
(0 rows)

explain (costs off)
select proname from pg_proc where proname ilike 'ri%foo' order by 1;
                           QUERY PLAN                            
-----------------------------------------------------------------
 Index Only Scan using pg_proc_proname_args_nsp_index on pg_proc
   Filter: (proname ~~* 'ri%foo'::text)
(2 rows)

set enable_indexscan to false;
set enable_bitmapscan to true;
explain (costs off)
select proname from pg_proc where proname like E'RI\\_FKey%del' order by 1;
                                        QUERY PLAN                                        
------------------------------------------------------------------------------------------
 Sort
   Sort Key: proname
   ->  Bitmap Heap Scan on pg_proc
         Filter: (proname ~~ 'RI\_FKey%del'::text)
         ->  Bitmap Index Scan on pg_proc_proname_args_nsp_index
               Index Cond: ((proname >= 'RI_FKey'::text) AND (proname < 'RI_FKez'::text))
(6 rows)

select proname from pg_proc where proname like E'RI\\_FKey%del' order by 1;
        proname         
------------------------
 RI_FKey_cascade_del
 RI_FKey_noaction_del
 RI_FKey_restrict_del
 RI_FKey_setdefault_del
 RI_FKey_setnull_del
(5 rows)

explain (costs off)
select proname from pg_proc where proname ilike '00%foo' order by 1;
                                   QUERY PLAN                                   
--------------------------------------------------------------------------------
 Sort
   Sort Key: proname
   ->  Bitmap Heap Scan on pg_proc
         Filter: (proname ~~* '00%foo'::text)
         ->  Bitmap Index Scan on pg_proc_proname_args_nsp_index
               Index Cond: ((proname >= '00'::text) AND (proname < '01'::text))
(6 rows)

select proname from pg_proc where proname ilike '00%foo' order by 1;
 proname 
---------
(0 rows)

explain (costs off)
select proname from pg_proc where proname ilike 'ri%foo' order by 1;
                  QUERY PLAN                  
----------------------------------------------
 Sort
   Sort Key: proname
   ->  Seq Scan on pg_proc
         Disabled: true
         Filter: (proname ~~* 'ri%foo'::text)
(5 rows)

reset enable_seqscan;
reset enable_indexscan;
reset enable_bitmapscan;
-- Also check LIKE optimization with binary-compatible cases
create temp table btree_bpchar (f1 text collate "C");
create index on btree_bpchar(f1 bpchar_ops) WITH (deduplicate_items=on);
insert into btree_bpchar values ('foo'), ('fool'), ('bar'), ('quux');
-- doesn't match index:
explain (costs off)
select * from btree_bpchar where f1 like 'foo';
          QUERY PLAN           
-------------------------------
 Seq Scan on btree_bpchar
   Filter: (f1 ~~ 'foo'::text)
(2 rows)

select * from btree_bpchar where f1 like 'foo';
 f1  
-----
 foo
(1 row)

explain (costs off)
select * from btree_bpchar where f1 like 'foo%';
           QUERY PLAN           
--------------------------------
 Seq Scan on btree_bpchar
   Filter: (f1 ~~ 'foo%'::text)
(2 rows)

select * from btree_bpchar where f1 like 'foo%';
  f1  
------
 foo
 fool
(2 rows)

-- these do match the index:
explain (costs off)
select * from btree_bpchar where f1::bpchar like 'foo';
                     QUERY PLAN                     
----------------------------------------------------
 Bitmap Heap Scan on btree_bpchar
   Filter: ((f1)::bpchar ~~ 'foo'::text)
   ->  Bitmap Index Scan on btree_bpchar_f1_idx
         Index Cond: ((f1)::bpchar = 'foo'::bpchar)
(4 rows)

select * from btree_bpchar where f1::bpchar like 'foo';
 f1  
-----
 foo
(1 row)

explain (costs off)
select * from btree_bpchar where f1::bpchar like 'foo%';
                                        QUERY PLAN                                        
------------------------------------------------------------------------------------------
 Bitmap Heap Scan on btree_bpchar
   Filter: ((f1)::bpchar ~~ 'foo%'::text)
   ->  Bitmap Index Scan on btree_bpchar_f1_idx
         Index Cond: (((f1)::bpchar >= 'foo'::bpchar) AND ((f1)::bpchar < 'fop'::bpchar))
(4 rows)

select * from btree_bpchar where f1::bpchar like 'foo%';
  f1  
------
 foo
 fool
(2 rows)

-- get test coverage for "single value" deduplication strategy:
insert into btree_bpchar select 'foo' from generate_series(1,1500);
--
-- Perform unique checking, with and without the use of deduplication
--
CREATE TABLE dedup_unique_test_table (a int) WITH (autovacuum_enabled=false);
CREATE UNIQUE INDEX dedup_unique ON dedup_unique_test_table (a) WITH (deduplicate_items=on);
CREATE UNIQUE INDEX plain_unique ON dedup_unique_test_table (a) WITH (deduplicate_items=off);
-- Generate enough garbage tuples in index to ensure that even the unique index
-- with deduplication enabled has to check multiple leaf pages during unique
-- checking (at least with a BLCKSZ of 8192 or less)
DO $$
BEGIN
    FOR r IN 1..1350 LOOP
        DELETE FROM dedup_unique_test_table;
        INSERT INTO dedup_unique_test_table SELECT 1;
    END LOOP;
END$$;
-- Exercise the LP_DEAD-bit-set tuple deletion code with a posting list tuple.
-- The implementation prefers deleting existing items to merging any duplicate
-- tuples into a posting list, so we need an explicit test to make sure we get
-- coverage (note that this test also assumes BLCKSZ is 8192 or less):
DROP INDEX plain_unique;
DELETE FROM dedup_unique_test_table WHERE a = 1;
INSERT INTO dedup_unique_test_table SELECT i FROM generate_series(0,450) i;
--
-- Test B-tree fast path (cache rightmost leaf page) optimization.
--
-- First create a tree that's at least three levels deep (i.e. has one level
-- between the root and leaf levels). The text inserted is long.  It won't be
-- TOAST compressed because we use plain storage in the table.  Only a few
-- index tuples fit on each internal page, allowing us to get a tall tree with
-- few pages.  (A tall tree is required to trigger caching.)
--
-- The text column must be the leading column in the index, since suffix
-- truncation would otherwise truncate tuples on internal pages, leaving us
-- with a short tree.
create table btree_tall_tbl(id int4, t text);
alter table btree_tall_tbl alter COLUMN t set storage plain;
create index btree_tall_idx on btree_tall_tbl (t, id) with (fillfactor = 10);
insert into btree_tall_tbl select g, repeat('x', 250)
from generate_series(1, 130) g;
insert into btree_tall_tbl select g, NULL
from generate_series(50, 60) g;
--
-- Test for skip scan with type that lacks skip support (text)
--
set enable_seqscan to false;
set enable_bitmapscan to false;
-- Forwards scan
SELECT id FROM btree_tall_tbl WHERE id = 55 ORDER BY t, id;
 id 
----
 55
 55
(2 rows)

explain (costs off)
SELECT id FROM btree_tall_tbl WHERE id = 55 ORDER BY t, id;
                       QUERY PLAN                       
--------------------------------------------------------
 Index Only Scan using btree_tall_idx on btree_tall_tbl
   Index Cond: (id = 55)
(2 rows)

-- Backwards scan
SELECT id FROM btree_tall_tbl WHERE id = 55 ORDER BY t DESC, id DESC;
 id 
----
 55
 55
(2 rows)

explain (costs off)
SELECT id FROM btree_tall_tbl WHERE id = 55 ORDER BY t DESC, id DESC;
                           QUERY PLAN                            
-----------------------------------------------------------------
 Index Only Scan Backward using btree_tall_idx on btree_tall_tbl
   Index Cond: (id = 55)
(2 rows)

reset enable_seqscan;
reset enable_bitmapscan;
--
-- Test for multilevel page deletion
--
CREATE TABLE delete_test_table (a bigint, b bigint, c bigint, d bigint);
INSERT INTO delete_test_table SELECT i, 1, 2, 3 FROM generate_series(1,80000) i;
ALTER TABLE delete_test_table ADD PRIMARY KEY (a,b,c,d);
-- Delete most entries, and vacuum, deleting internal pages and creating "fast
-- root"
DELETE FROM delete_test_table WHERE a < 79990;
VACUUM delete_test_table;
--
-- Test B-tree insertion with a metapage update (XLOG_BTREE_INSERT_META
-- WAL record type). This happens when a "fast root" page is split.  This
-- also creates coverage for nbtree FSM page recycling.
--
-- The vacuum above should've turned the leaf page into a fast root. We just
-- need to insert some rows to cause the fast root page to split.
INSERT INTO delete_test_table SELECT i, 1, 2, 3 FROM generate_series(1,1000) i;
-- Test unsupported btree opclass parameters
create index on btree_tall_tbl (id int4_ops(foo=1));
ERROR:  operator class int4_ops has no options
-- test parallel build with immutable function.
CREATE TABLE btree_test_expr (n int);
CREATE FUNCTION btree_test_func() RETURNS int LANGUAGE sql IMMUTABLE RETURN 0;
BEGIN;
SET LOCAL min_parallel_table_scan_size = 0;
SET LOCAL max_parallel_maintenance_workers = 4;
CREATE INDEX btree_test_expr_idx ON btree_test_expr USING btree (btree_test_func());
COMMIT;
DROP TABLE btree_test_expr;
DROP FUNCTION btree_test_func();
-- Test case of ALTER INDEX with abuse of column names for indexes.
-- This grammar is not officially supported, but the parser allows it.
CREATE INDEX btree_tall_idx2 ON btree_tall_tbl (id);
ALTER INDEX btree_tall_idx2 ALTER COLUMN id SET (n_distinct=100);
ERROR:  ALTER action ALTER COLUMN ... SET cannot be performed on relation "btree_tall_idx2"
DETAIL:  This operation is not supported for indexes.
DROP INDEX btree_tall_idx2;
-- Partitioned index
CREATE TABLE btree_part (id int4) PARTITION BY RANGE (id);
CREATE INDEX btree_part_idx ON btree_part(id);
ALTER INDEX btree_part_idx ALTER COLUMN id SET (n_distinct=100);
ERROR:  ALTER action ALTER COLUMN ... SET cannot be performed on relation "btree_part_idx"
DETAIL:  This operation is not supported for partitioned indexes.
DROP TABLE btree_part;
--
-- Test btree skip scan support for types that currently lack test coverage
-- (exercises btXXXskipsupport, XXX_decrement, XXX_increment functions)
--
SET enable_seqscan = off;
SET enable_bitmapscan = off;
-- int8: btint8skipsupport, int8_decrement, int8_increment
CREATE TABLE skip_int8 (a int8, b int4);
INSERT INTO skip_int8 SELECT i / 10, i % 10 FROM generate_series(1, 100) i;
CREATE INDEX ON skip_int8 (a, b);
EXPLAIN (COSTS OFF)
SELECT a, b FROM skip_int8 WHERE b = 5 ORDER BY a;
                      QUERY PLAN                      
------------------------------------------------------
 Index Only Scan using skip_int8_a_b_idx on skip_int8
   Index Cond: (b = 5)
(2 rows)

SELECT a, b FROM skip_int8 WHERE b = 5 ORDER BY a;
 a | b 
---+---
 0 | 5
 1 | 5
 2 | 5
 3 | 5
 4 | 5
 5 | 5
 6 | 5
 7 | 5
 8 | 5
 9 | 5
(10 rows)

EXPLAIN (COSTS OFF)
SELECT a, b FROM skip_int8 WHERE b = 5 ORDER BY a DESC;
                          QUERY PLAN                           
---------------------------------------------------------------
 Index Only Scan Backward using skip_int8_a_b_idx on skip_int8
   Index Cond: (b = 5)
(2 rows)

SELECT a, b FROM skip_int8 WHERE b = 5 ORDER BY a DESC;
 a | b 
---+---
 9 | 5
 8 | 5
 7 | 5
 6 | 5
 5 | 5
 4 | 5
 3 | 5
 2 | 5
 1 | 5
 0 | 5
(10 rows)

DROP TABLE skip_int8;
-- oid8: btoid8skipsupport, oid8_decrement, oid8_increment
CREATE TABLE skip_oid8 (a oid8, b int4);
INSERT INTO skip_oid8 SELECT (i / 10)::int8::oid8, i % 10 FROM generate_series(1, 100) i;
CREATE INDEX ON skip_oid8 (a, b);
EXPLAIN (COSTS OFF)
SELECT a, b FROM skip_oid8 WHERE b = 5 ORDER BY a;
                      QUERY PLAN                      
------------------------------------------------------
 Index Only Scan using skip_oid8_a_b_idx on skip_oid8
   Index Cond: (b = 5)
(2 rows)

SELECT a, b FROM skip_oid8 WHERE b = 5 ORDER BY a;
 a | b 
---+---
 0 | 5
 1 | 5
 2 | 5
 3 | 5
 4 | 5
 5 | 5
 6 | 5
 7 | 5
 8 | 5
 9 | 5
(10 rows)

EXPLAIN (COSTS OFF)
SELECT a, b FROM skip_oid8 WHERE b = 5 ORDER BY a DESC;
                          QUERY PLAN                           
---------------------------------------------------------------
 Index Only Scan Backward using skip_oid8_a_b_idx on skip_oid8
   Index Cond: (b = 5)
(2 rows)

SELECT a, b FROM skip_oid8 WHERE b = 5 ORDER BY a DESC;
 a | b 
---+---
 9 | 5
 8 | 5
 7 | 5
 6 | 5
 5 | 5
 4 | 5
 3 | 5
 2 | 5
 1 | 5
 0 | 5
(10 rows)

DROP TABLE skip_oid8;
-- bool: btboolskipsupport, bool_decrement, bool_increment
CREATE TABLE skip_bool (a bool, b int4);
INSERT INTO skip_bool SELECT (i % 2 = 0), i FROM generate_series(1, 100) i;
CREATE INDEX ON skip_bool (a, b);
EXPLAIN (COSTS OFF)
SELECT a, b FROM skip_bool WHERE b = 50 ORDER BY a;
                      QUERY PLAN                      
------------------------------------------------------
 Index Only Scan using skip_bool_a_b_idx on skip_bool
   Index Cond: (b = 50)
(2 rows)

SELECT a, b FROM skip_bool WHERE b = 50 ORDER BY a;
 a | b  
---+----
 t | 50
(1 row)

EXPLAIN (COSTS OFF)
SELECT a, b FROM skip_bool WHERE b = 50 ORDER BY a DESC;
                          QUERY PLAN                           
---------------------------------------------------------------
 Index Only Scan Backward using skip_bool_a_b_idx on skip_bool
   Index Cond: (b = 50)
(2 rows)

SELECT a, b FROM skip_bool WHERE b = 50 ORDER BY a DESC;
 a | b  
---+----
 t | 50
(1 row)

DROP TABLE skip_bool;
-- "char": btcharskipsupport, char_decrement, char_increment
CREATE TABLE skip_char (a "char", b int4);
INSERT INTO skip_char SELECT chr(ascii('a') + (i % 26))::"char", i FROM generate_series(1, 100) i;
CREATE INDEX ON skip_char (a, b);
EXPLAIN (COSTS OFF)
SELECT a, b FROM skip_char WHERE b = 50 ORDER BY a;
                      QUERY PLAN                      
------------------------------------------------------
 Index Only Scan using skip_char_a_b_idx on skip_char
   Index Cond: (b = 50)
(2 rows)

SELECT a, b FROM skip_char WHERE b = 50 ORDER BY a;
 a | b  
---+----
 y | 50
(1 row)

EXPLAIN (COSTS OFF)
SELECT a, b FROM skip_char WHERE b = 50 ORDER BY a DESC;
                          QUERY PLAN                           
---------------------------------------------------------------
 Index Only Scan Backward using skip_char_a_b_idx on skip_char
   Index Cond: (b = 50)
(2 rows)

SELECT a, b FROM skip_char WHERE b = 50 ORDER BY a DESC;
 a | b  
---+----
 y | 50
(1 row)

DROP TABLE skip_char;
-- oid: btoidskipsupport, oid_decrement, oid_increment
CREATE TABLE skip_oid (a oid, b int4);
INSERT INTO skip_oid SELECT (i / 10)::oid, i % 10 FROM generate_series(1, 100) i;
CREATE INDEX ON skip_oid (a, b);
EXPLAIN (COSTS OFF)
SELECT a, b FROM skip_oid WHERE b = 5 ORDER BY a DESC;
                         QUERY PLAN                          
-------------------------------------------------------------
 Index Only Scan Backward using skip_oid_a_b_idx on skip_oid
   Index Cond: (b = 5)
(2 rows)

SELECT a, b FROM skip_oid WHERE b = 5 ORDER BY a DESC;
 a | b 
---+---
 9 | 5
 8 | 5
 7 | 5
 6 | 5
 5 | 5
 4 | 5
 3 | 5
 2 | 5
 1 | 5
 0 | 5
(10 rows)

DROP TABLE skip_oid;
-- int2: btint2skipsupport, int2_decrement, int2_increment
CREATE TABLE skip_int2 (a int2, b int4);
INSERT INTO skip_int2 SELECT (i / 10)::int2, i % 10 FROM generate_series(1, 100) i;
CREATE INDEX ON skip_int2 (a, b);
EXPLAIN (COSTS OFF)
SELECT a, b FROM skip_int2 WHERE b = 5 ORDER BY a;
                      QUERY PLAN                      
------------------------------------------------------
 Index Only Scan using skip_int2_a_b_idx on skip_int2
   Index Cond: (b = 5)
(2 rows)

SELECT a, b FROM skip_int2 WHERE b = 5 ORDER BY a;
 a | b 
---+---
 0 | 5
 1 | 5
 2 | 5
 3 | 5
 4 | 5
 5 | 5
 6 | 5
 7 | 5
 8 | 5
 9 | 5
(10 rows)

EXPLAIN (COSTS OFF)
SELECT a, b FROM skip_int2 WHERE b = 5 ORDER BY a DESC;
                          QUERY PLAN                           
---------------------------------------------------------------
 Index Only Scan Backward using skip_int2_a_b_idx on skip_int2
   Index Cond: (b = 5)
(2 rows)

SELECT a, b FROM skip_int2 WHERE b = 5 ORDER BY a DESC;
 a | b 
---+---
 9 | 5
 8 | 5
 7 | 5
 6 | 5
 5 | 5
 4 | 5
 3 | 5
 2 | 5
 1 | 5
 0 | 5
(10 rows)

DROP TABLE skip_int2;
--
-- Boundary cases: exercise the *_increment overflow / *_decrement
-- underflow branches in skip-scan helpers.
--
-- int2 boundaries (int2_increment overflow at INT2_MAX, int2_decrement
-- underflow at INT2_MIN)
CREATE TABLE skip_int2_max (a int2, b int4);
INSERT INTO skip_int2_max VALUES (32765::int2, 1), (32766::int2, 1), (32767::int2, 1);
CREATE INDEX ON skip_int2_max (a, b);
EXPLAIN (COSTS OFF) SELECT a, b FROM skip_int2_max WHERE b = 1 ORDER BY a;
                          QUERY PLAN                          
--------------------------------------------------------------
 Index Only Scan using skip_int2_max_a_b_idx on skip_int2_max
   Index Cond: (b = 1)
(2 rows)

SELECT a, b FROM skip_int2_max WHERE b = 1 ORDER BY a;
   a   | b 
-------+---
 32765 | 1
 32766 | 1
 32767 | 1
(3 rows)

DROP TABLE skip_int2_max;
CREATE TABLE skip_int2_min (a int2, b int4);
INSERT INTO skip_int2_min VALUES ((-32766)::int2, 1), ((-32767)::int2, 1), ((-32768)::int2, 1);
CREATE INDEX ON skip_int2_min (a, b);
EXPLAIN (COSTS OFF) SELECT a, b FROM skip_int2_min WHERE b = 1 ORDER BY a DESC;
                              QUERY PLAN                               
-----------------------------------------------------------------------
 Index Only Scan Backward using skip_int2_min_a_b_idx on skip_int2_min
   Index Cond: (b = 1)
(2 rows)

SELECT a, b FROM skip_int2_min WHERE b = 1 ORDER BY a DESC;
   a    | b 
--------+---
 -32766 | 1
 -32767 | 1
 -32768 | 1
(3 rows)

DROP TABLE skip_int2_min;
-- int4 boundaries
CREATE TABLE skip_int4_max (a int4, b int4);
INSERT INTO skip_int4_max VALUES (2147483645, 1), (2147483646, 1), (2147483647, 1);
CREATE INDEX ON skip_int4_max (a, b);
EXPLAIN (COSTS OFF) SELECT a, b FROM skip_int4_max WHERE b = 1 ORDER BY a;
                          QUERY PLAN                          
--------------------------------------------------------------
 Index Only Scan using skip_int4_max_a_b_idx on skip_int4_max
   Index Cond: (b = 1)
(2 rows)

SELECT a, b FROM skip_int4_max WHERE b = 1 ORDER BY a;
     a      | b 
------------+---
 2147483645 | 1
 2147483646 | 1
 2147483647 | 1
(3 rows)

DROP TABLE skip_int4_max;
CREATE TABLE skip_int4_min (a int4, b int4);
INSERT INTO skip_int4_min VALUES (-2147483646, 1), (-2147483647, 1), (-2147483648, 1);
CREATE INDEX ON skip_int4_min (a, b);
EXPLAIN (COSTS OFF) SELECT a, b FROM skip_int4_min WHERE b = 1 ORDER BY a DESC;
                              QUERY PLAN                               
-----------------------------------------------------------------------
 Index Only Scan Backward using skip_int4_min_a_b_idx on skip_int4_min
   Index Cond: (b = 1)
(2 rows)

SELECT a, b FROM skip_int4_min WHERE b = 1 ORDER BY a DESC;
      a      | b 
-------------+---
 -2147483646 | 1
 -2147483647 | 1
 -2147483648 | 1
(3 rows)

DROP TABLE skip_int4_min;
-- int8 boundaries
CREATE TABLE skip_int8_max (a int8, b int4);
INSERT INTO skip_int8_max VALUES (9223372036854775805::int8, 1),
                                  (9223372036854775806::int8, 1),
                                  (9223372036854775807::int8, 1);
CREATE INDEX ON skip_int8_max (a, b);
EXPLAIN (COSTS OFF) SELECT a, b FROM skip_int8_max WHERE b = 1 ORDER BY a;
                          QUERY PLAN                          
--------------------------------------------------------------
 Index Only Scan using skip_int8_max_a_b_idx on skip_int8_max
   Index Cond: (b = 1)
(2 rows)

SELECT a, b FROM skip_int8_max WHERE b = 1 ORDER BY a;
          a          | b 
---------------------+---
 9223372036854775805 | 1
 9223372036854775806 | 1
 9223372036854775807 | 1
(3 rows)

DROP TABLE skip_int8_max;
CREATE TABLE skip_int8_min (a int8, b int4);
INSERT INTO skip_int8_min VALUES ((-9223372036854775806)::int8, 1),
                                  ((-9223372036854775807)::int8, 1),
                                  ((-9223372036854775808)::int8, 1);
CREATE INDEX ON skip_int8_min (a, b);
EXPLAIN (COSTS OFF) SELECT a, b FROM skip_int8_min WHERE b = 1 ORDER BY a DESC;
                              QUERY PLAN                               
-----------------------------------------------------------------------
 Index Only Scan Backward using skip_int8_min_a_b_idx on skip_int8_min
   Index Cond: (b = 1)
(2 rows)

SELECT a, b FROM skip_int8_min WHERE b = 1 ORDER BY a DESC;
          a           | b 
----------------------+---
 -9223372036854775806 | 1
 -9223372036854775807 | 1
 -9223372036854775808 | 1
(3 rows)

DROP TABLE skip_int8_min;
-- oid boundaries (oid_increment overflow at OID_MAX, oid_decrement underflow at 0)
CREATE TABLE skip_oid_max (a oid, b int4);
INSERT INTO skip_oid_max VALUES (4294967293::oid, 1), (4294967294::oid, 1), (4294967295::oid, 1);
CREATE INDEX ON skip_oid_max (a, b);
EXPLAIN (COSTS OFF) SELECT a, b FROM skip_oid_max WHERE b = 1 ORDER BY a;
                         QUERY PLAN                         
------------------------------------------------------------
 Index Only Scan using skip_oid_max_a_b_idx on skip_oid_max
   Index Cond: (b = 1)
(2 rows)

SELECT a, b FROM skip_oid_max WHERE b = 1 ORDER BY a;
     a      | b 
------------+---
 4294967293 | 1
 4294967294 | 1
 4294967295 | 1
(3 rows)

DROP TABLE skip_oid_max;
CREATE TABLE skip_oid_min (a oid, b int4);
INSERT INTO skip_oid_min VALUES (0::oid, 1), (1::oid, 1), (2::oid, 1);
CREATE INDEX ON skip_oid_min (a, b);
EXPLAIN (COSTS OFF) SELECT a, b FROM skip_oid_min WHERE b = 1 ORDER BY a DESC;
                             QUERY PLAN                              
---------------------------------------------------------------------
 Index Only Scan Backward using skip_oid_min_a_b_idx on skip_oid_min
   Index Cond: (b = 1)
(2 rows)

SELECT a, b FROM skip_oid_min WHERE b = 1 ORDER BY a DESC;
 a | b 
---+---
 2 | 1
 1 | 1
 0 | 1
(3 rows)

DROP TABLE skip_oid_min;
-- oid8 boundaries (uint64 range)
CREATE TABLE skip_oid8_max (a oid8, b int4);
INSERT INTO skip_oid8_max VALUES ('18446744073709551613'::oid8, 1),
                                  ('18446744073709551614'::oid8, 1),
                                  ('18446744073709551615'::oid8, 1);
CREATE INDEX ON skip_oid8_max (a, b);
EXPLAIN (COSTS OFF) SELECT a, b FROM skip_oid8_max WHERE b = 1 ORDER BY a;
                          QUERY PLAN                          
--------------------------------------------------------------
 Index Only Scan using skip_oid8_max_a_b_idx on skip_oid8_max
   Index Cond: (b = 1)
(2 rows)

SELECT a, b FROM skip_oid8_max WHERE b = 1 ORDER BY a;
          a           | b 
----------------------+---
 18446744073709551613 | 1
 18446744073709551614 | 1
 18446744073709551615 | 1
(3 rows)

DROP TABLE skip_oid8_max;
CREATE TABLE skip_oid8_min (a oid8, b int4);
INSERT INTO skip_oid8_min VALUES (0::oid8, 1), (1::oid8, 1), (2::oid8, 1);
CREATE INDEX ON skip_oid8_min (a, b);
EXPLAIN (COSTS OFF) SELECT a, b FROM skip_oid8_min WHERE b = 1 ORDER BY a DESC;
                              QUERY PLAN                               
-----------------------------------------------------------------------
 Index Only Scan Backward using skip_oid8_min_a_b_idx on skip_oid8_min
   Index Cond: (b = 1)
(2 rows)

SELECT a, b FROM skip_oid8_min WHERE b = 1 ORDER BY a DESC;
 a | b 
---+---
 2 | 1
 1 | 1
 0 | 1
(3 rows)

DROP TABLE skip_oid8_min;
-- "char" boundaries (uint8 byte range: char_increment overflow at 255,
-- char_decrement underflow at 0).  "char" input cast accepts -128..127 for
-- a signed int1, so bytes 254 and 255 are written as -2 and -1.
CREATE TABLE skip_char_max (a "char", b int4);
INSERT INTO skip_char_max VALUES ((-3)::"char", 1), ((-2)::"char", 1), ((-1)::"char", 1);
CREATE INDEX ON skip_char_max (a, b);
EXPLAIN (COSTS OFF) SELECT a, b FROM skip_char_max WHERE b = 1 ORDER BY a;
                          QUERY PLAN                          
--------------------------------------------------------------
 Index Only Scan using skip_char_max_a_b_idx on skip_char_max
   Index Cond: (b = 1)
(2 rows)

SELECT a, b FROM skip_char_max WHERE b = 1 ORDER BY a;
  a   | b 
------+---
 \375 | 1
 \376 | 1
 \377 | 1
(3 rows)

DROP TABLE skip_char_max;
CREATE TABLE skip_char_min (a "char", b int4);
INSERT INTO skip_char_min VALUES (0::"char", 1), (1::"char", 1), (2::"char", 1);
CREATE INDEX ON skip_char_min (a, b);
EXPLAIN (COSTS OFF) SELECT a, b FROM skip_char_min WHERE b = 1 ORDER BY a DESC;
                              QUERY PLAN                               
-----------------------------------------------------------------------
 Index Only Scan Backward using skip_char_min_a_b_idx on skip_char_min
   Index Cond: (b = 1)
(2 rows)

SELECT a, b FROM skip_char_min WHERE b = 1 ORDER BY a DESC;
  a   | b 
------+---
 \x02 | 1
 \x01 | 1
      | 1
(3 rows)

DROP TABLE skip_char_min;
RESET enable_seqscan;
RESET enable_bitmapscan;
