-- create a table to use as a basis for views and materialized views in various combinations
CREATE TABLE mv_base_a (x int, i int, y int, j int);
CREATE TABLE mv_base_b (x int, i int, y int, k int);
-- test for base tables with dropped columns
ALTER TABLE mv_base_a DROP COLUMN x;
ALTER TABLE mv_base_a DROP COLUMN y;
ALTER TABLE mv_base_b DROP COLUMN x;
ALTER TABLE mv_base_b DROP COLUMN y;
INSERT INTO mv_base_a VALUES
  (1,10),
  (2,20),
  (3,30),
  (4,40),
  (5,50);
INSERT INTO mv_base_b VALUES
  (1,101),
  (2,102),
  (3,103),
  (4,104);
CREATE INCREMENTAL MATERIALIZED VIEW mv_ivm_1 AS SELECT i,j,k FROM mv_base_a a INNER JOIN mv_base_b b USING(i) WITH NO DATA;
SELECT * FROM mv_ivm_1 ORDER BY 1,2,3;
ERROR:  materialized view "mv_ivm_1" has not been populated
HINT:  Use the REFRESH MATERIALIZED VIEW command.
REFRESH MATERIALIZED VIEW mv_ivm_1;
NOTICE:  could not create an index on materialized view "mv_ivm_1" automatically
DETAIL:  This target list does not have all the primary key columns. 
HINT:  Create an index on the materialized view for efficient incremental maintenance.
SELECT * FROM mv_ivm_1 ORDER BY 1,2,3;
 i | j  |  k  
---+----+-----
 1 | 10 | 101
 2 | 20 | 102
 3 | 30 | 103
 4 | 40 | 104
(4 rows)

-- REFRESH WITH NO DATA
BEGIN;
CREATE FUNCTION dummy_ivm_trigger_func() RETURNS TRIGGER AS $$
  BEGIN
    RETURN NULL;
  END
$$ language plpgsql;
CREATE CONSTRAINT TRIGGER dummy_ivm_trigger AFTER INSERT
ON mv_base_a FROM mv_ivm_1 FOR EACH ROW
EXECUTE PROCEDURE dummy_ivm_trigger_func();
SELECT COUNT(*)
FROM pg_depend pd INNER JOIN pg_trigger pt ON pd.objid = pt.oid
WHERE pd.classid = 'pg_trigger'::regclass AND pd.refobjid = 'mv_ivm_1'::regclass;
 count 
-------
    17
(1 row)

REFRESH MATERIALIZED VIEW mv_ivm_1 WITH NO DATA;
SELECT COUNT(*)
FROM pg_depend pd INNER JOIN pg_trigger pt ON pd.objid = pt.oid
WHERE pd.classid = 'pg_trigger'::regclass AND pd.refobjid = 'mv_ivm_1'::regclass;
 count 
-------
     1
(1 row)

ROLLBACK;
-- immediate maintenance
BEGIN;
INSERT INTO mv_base_b VALUES(5,105);
SELECT * FROM mv_ivm_1 ORDER BY 1,2,3;
 i | j  |  k  
---+----+-----
 1 | 10 | 101
 2 | 20 | 102
 3 | 30 | 103
 4 | 40 | 104
 5 | 50 | 105
(5 rows)

UPDATE mv_base_a SET j = 0 WHERE i = 1;
SELECT * FROM mv_ivm_1 ORDER BY 1,2,3;
 i | j  |  k  
---+----+-----
 1 |  0 | 101
 2 | 20 | 102
 3 | 30 | 103
 4 | 40 | 104
 5 | 50 | 105
(5 rows)

DELETE FROM mv_base_b WHERE (i,k) = (5,105);
SELECT * FROM mv_ivm_1 ORDER BY 1,2,3;
 i | j  |  k  
---+----+-----
 1 |  0 | 101
 2 | 20 | 102
 3 | 30 | 103
 4 | 40 | 104
(4 rows)

ROLLBACK;
SELECT * FROM mv_ivm_1 ORDER BY 1,2,3;
 i | j  |  k  
---+----+-----
 1 | 10 | 101
 2 | 20 | 102
 3 | 30 | 103
 4 | 40 | 104
(4 rows)

-- DISTINCT not supported
CREATE INCREMENTAL MATERIALIZED VIEW mv_ivm_distinct AS SELECT DISTINCT * FROM mv_base_a;
ERROR:  DISTINCT is not supported on incrementally maintainable materialized view
-- test for renaming column name to camel style
BEGIN;
ALTER TABLE mv_base_a RENAME i TO "I";
ALTER TABLE mv_base_a RENAME j TO "J";
UPDATE mv_base_a SET "J" = 0 WHERE "I" = 1;
SELECT * FROM mv_ivm_1 ORDER BY 1,2,3;
 i | j  |  k  
---+----+-----
 1 |  0 | 101
 2 | 20 | 102
 3 | 30 | 103
 4 | 40 | 104
(4 rows)

ROLLBACK;
-- TRUNCATE a base table in join views
BEGIN;
TRUNCATE mv_base_a;
SELECT * FROM mv_ivm_1;
 i | j | k 
---+---+---
(0 rows)

ROLLBACK;
BEGIN;
TRUNCATE mv_base_b;
SELECT * FROM mv_ivm_1;
 i | j | k 
---+---+---
(0 rows)

ROLLBACK;
-- some query syntax
BEGIN;
CREATE FUNCTION ivm_func() RETURNS int LANGUAGE 'sql'
       AS 'SELECT 1' IMMUTABLE;
CREATE INCREMENTAL MATERIALIZED VIEW mv_ivm_func AS SELECT * FROM ivm_func();
NOTICE:  could not create an index on materialized view "mv_ivm_func" automatically
DETAIL:  This target list does not have all the primary key columns. 
HINT:  Create an index on the materialized view for efficient incremental maintenance.
CREATE INCREMENTAL MATERIALIZED VIEW mv_ivm_no_tbl AS SELECT 1;
NOTICE:  could not create an index on materialized view "mv_ivm_no_tbl" automatically
DETAIL:  This target list does not have all the primary key columns. 
HINT:  Create an index on the materialized view for efficient incremental maintenance.
ROLLBACK;
-- result of materialized view have duplicate result.
BEGIN;
CREATE INCREMENTAL MATERIALIZED VIEW mv_ivm_duplicate AS SELECT j FROM mv_base_a;
NOTICE:  could not create an index on materialized view "mv_ivm_duplicate" automatically
DETAIL:  This target list does not have all the primary key columns. 
HINT:  Create an index on the materialized view for efficient incremental maintenance.
INSERT INTO mv_base_a VALUES(6,20);
SELECT * FROM mv_ivm_duplicate ORDER BY 1;
 j  
----
 10
 20
 20
 30
 40
 50
(6 rows)

DELETE FROM mv_base_a WHERE (i,j) = (2,20);
SELECT * FROM mv_ivm_duplicate ORDER BY 1;
 j  
----
 10
 20
 30
 40
 50
(5 rows)

ROLLBACK;
-- aggregate not supported
CREATE INCREMENTAL MATERIALIZED VIEW mv_ivm_agg AS SELECT i, SUM(j), COUNT(i), AVG(j) FROM mv_base_a GROUP BY i;
ERROR:  aggregate function is not supported on incrementally maintainable materialized view
-- support self join view and multiple change on the same table
BEGIN;
CREATE TABLE base_t (i int, v int);
INSERT INTO base_t VALUES (1, 10), (2, 20), (3, 30);
CREATE INCREMENTAL MATERIALIZED VIEW mv_self(v1, v2) AS
 SELECT t1.v, t2.v FROM base_t AS t1 JOIN base_t AS t2 ON t1.i = t2.i;
NOTICE:  could not create an index on materialized view "mv_self" automatically
DETAIL:  This target list does not have all the primary key columns. 
HINT:  Create an index on the materialized view for efficient incremental maintenance.
SELECT * FROM mv_self ORDER BY v1;
 v1 | v2 
----+----
 10 | 10
 20 | 20
 30 | 30
(3 rows)

INSERT INTO base_t VALUES (4,40);
DELETE FROM base_t WHERE i = 1;
UPDATE base_t SET v = v*10 WHERE i=2;
SELECT * FROM mv_self ORDER BY v1;
 v1  | v2  
-----+-----
  30 |  30
  40 |  40
 200 | 200
(3 rows)

WITH
 ins_t1 AS (INSERT INTO base_t VALUES (5,50) RETURNING 1),
 ins_t2 AS (INSERT INTO base_t VALUES (6,60) RETURNING 1),
 upd_t AS (UPDATE base_t SET v = v + 100  RETURNING 1),
 dlt_t AS (DELETE FROM base_t WHERE i IN (4,5)  RETURNING 1)
SELECT NULL;
 ?column? 
----------
 
(1 row)

SELECT * FROM mv_self ORDER BY v1;
 v1  | v2  
-----+-----
  50 |  50
  60 |  60
 130 | 130
 300 | 300
(4 rows)

--- with sub-transactions
SAVEPOINT p1;
INSERT INTO base_t VALUES (7,70);
RELEASE SAVEPOINT p1;
INSERT INTO base_t VALUES (7,77);
SELECT * FROM mv_self ORDER BY v1, v2;
 v1  | v2  
-----+-----
  50 |  50
  60 |  60
  70 |  70
  70 |  77
  77 |  70
  77 |  77
 130 | 130
 300 | 300
(8 rows)

ROLLBACK;
-- support simultaneous table changes
BEGIN;
CREATE TABLE base_r (i int, v int);
CREATE TABLE base_s (i int, v int);
INSERT INTO base_r VALUES (1, 10), (2, 20), (3, 30);
INSERT INTO base_s VALUES (1, 100), (2, 200), (3, 300);
CREATE INCREMENTAL MATERIALIZED VIEW mv(v1, v2) AS
 SELECT r.v, s.v FROM base_r AS r JOIN base_s AS s USING(i);
NOTICE:  could not create an index on materialized view "mv" automatically
DETAIL:  This target list does not have all the primary key columns. 
HINT:  Create an index on the materialized view for efficient incremental maintenance.
SELECT * FROM mv ORDER BY v1;
 v1 | v2  
----+-----
 10 | 100
 20 | 200
 30 | 300
(3 rows)

WITH
 ins_r AS (INSERT INTO base_r VALUES (1,11) RETURNING 1),
 ins_r2 AS (INSERT INTO base_r VALUES (3,33) RETURNING 1),
 ins_s AS (INSERT INTO base_s VALUES (2,222) RETURNING 1),
 upd_r AS (UPDATE base_r SET v = v + 1000 WHERE i = 2 RETURNING 1),
 dlt_s AS (DELETE FROM base_s WHERE i = 3 RETURNING 1)
SELECT NULL;
 ?column? 
----------
 
(1 row)

SELECT * FROM mv ORDER BY v1;
  v1  | v2  
------+-----
   10 | 100
   11 | 100
 1020 | 200
 1020 | 222
(4 rows)

ROLLBACK;
-- support foreign reference constraints
BEGIN;
CREATE TABLE ri1 (i int PRIMARY KEY);
CREATE TABLE ri2 (i int PRIMARY KEY REFERENCES ri1(i) ON UPDATE CASCADE ON DELETE CASCADE, v int);
INSERT INTO ri1 VALUES (1),(2),(3);
INSERT INTO ri2 VALUES (1),(2),(3);
CREATE INCREMENTAL MATERIALIZED VIEW mv_ri(i1, i2) AS
 SELECT ri1.i, ri2.i FROM ri1 JOIN ri2 USING(i);
NOTICE:  created index "mv_ri_index" on materialized view "mv_ri"
SELECT * FROM mv_ri ORDER BY i1;
 i1 | i2 
----+----
  1 |  1
  2 |  2
  3 |  3
(3 rows)

UPDATE ri1 SET i=10 where i=1;
DELETE FROM ri1 WHERE i=2;
SELECT * FROM mv_ri ORDER BY i2;
 i1 | i2 
----+----
  3 |  3
 10 | 10
(2 rows)

ROLLBACK;
-- views including NULL
BEGIN;
CREATE TABLE base_t (i int, v int);
INSERT INTO base_t VALUES (1,10),(2, NULL);
CREATE INCREMENTAL MATERIALIZED VIEW mv AS SELECT * FROM base_t;
NOTICE:  could not create an index on materialized view "mv" automatically
DETAIL:  This target list does not have all the primary key columns. 
HINT:  Create an index on the materialized view for efficient incremental maintenance.
SELECT * FROM mv ORDER BY i;
 i | v  
---+----
 1 | 10
 2 |   
(2 rows)

UPDATE base_t SET v = 20 WHERE i = 2;
SELECT * FROM mv ORDER BY i;
 i | v  
---+----
 1 | 10
 2 | 20
(2 rows)

ROLLBACK;
BEGIN;
CREATE TABLE base_t (i int);
CREATE INCREMENTAL MATERIALIZED VIEW mv AS SELECT * FROM base_t;
NOTICE:  could not create an index on materialized view "mv" automatically
DETAIL:  This target list does not have all the primary key columns. 
HINT:  Create an index on the materialized view for efficient incremental maintenance.
SELECT * FROM mv ORDER BY i;
 i 
---
(0 rows)

INSERT INTO base_t VALUES (1),(NULL);
SELECT * FROM mv ORDER BY i;
 i 
---
 1
  
(2 rows)

ROLLBACK;
-- IMMV containing user defined type
BEGIN;
CREATE TYPE mytype;
CREATE FUNCTION mytype_in(cstring)
 RETURNS mytype AS 'int4in'
 LANGUAGE INTERNAL STRICT IMMUTABLE;
NOTICE:  return type mytype is only a shell
CREATE FUNCTION mytype_out(mytype)
 RETURNS cstring AS 'int4out'
 LANGUAGE INTERNAL STRICT IMMUTABLE;
NOTICE:  argument type mytype is only a shell
LINE 1: CREATE FUNCTION mytype_out(mytype)
                                   ^
CREATE TYPE mytype (
 LIKE = int4,
 INPUT = mytype_in,
 OUTPUT = mytype_out
);
CREATE FUNCTION mytype_eq(mytype, mytype)
 RETURNS bool AS 'int4eq'
 LANGUAGE INTERNAL STRICT IMMUTABLE;
CREATE FUNCTION mytype_lt(mytype, mytype)
 RETURNS bool AS 'int4lt'
 LANGUAGE INTERNAL STRICT IMMUTABLE;
CREATE FUNCTION mytype_cmp(mytype, mytype)
 RETURNS integer AS 'btint4cmp'
 LANGUAGE INTERNAL STRICT IMMUTABLE;
CREATE OPERATOR = (
 leftarg = mytype, rightarg = mytype,
 procedure = mytype_eq);
CREATE OPERATOR < (
 leftarg = mytype, rightarg = mytype,
 procedure = mytype_lt);
CREATE OPERATOR CLASS mytype_ops
 DEFAULT FOR TYPE mytype USING btree AS
 OPERATOR        1       <,
 OPERATOR        3       = ,
 FUNCTION		1		mytype_cmp(mytype,mytype);
CREATE TABLE t_mytype (x mytype);
CREATE INCREMENTAL MATERIALIZED VIEW mv_mytype AS
 SELECT * FROM t_mytype;
NOTICE:  could not create an index on materialized view "mv_mytype" automatically
DETAIL:  This target list does not have all the primary key columns. 
HINT:  Create an index on the materialized view for efficient incremental maintenance.
INSERT INTO t_mytype VALUES ('1'::mytype);
SELECT * FROM mv_mytype;
 x 
---
 1
(1 row)

ROLLBACK;
-- outer join is not supported
CREATE INCREMENTAL MATERIALIZED VIEW mv(a,b) AS SELECT a.i, b.i FROM mv_base_a a LEFT JOIN mv_base_b b ON a.i=b.i;
ERROR:  OUTER JOIN is not supported on incrementally maintainable materialized view
-- CTE is not supported
CREATE INCREMENTAL MATERIALIZED VIEW mv AS
    WITH b AS ( SELECT * FROM mv_base_b) SELECT a.i,a.j FROM mv_base_a a, b WHERE a.i = b.i;
ERROR:  CTE is not supported on incrementally maintainable materialized view
-- contain system column
CREATE INCREMENTAL MATERIALIZED VIEW  mv_ivm01 AS SELECT i,j,xmin FROM mv_base_a;
ERROR:  system column is not supported on incrementally maintainable materialized view
CREATE INCREMENTAL MATERIALIZED VIEW  mv_ivm02 AS SELECT i,j FROM mv_base_a WHERE xmin = '610';
ERROR:  system column is not supported on incrementally maintainable materialized view
CREATE INCREMENTAL MATERIALIZED VIEW  mv_ivm04 AS SELECT i,j,xmin::text AS x_min FROM mv_base_a;
ERROR:  system column is not supported on incrementally maintainable materialized view
CREATE INCREMENTAL MATERIALIZED VIEW  mv_ivm06 AS SELECT i,j,xidsend(xmin) AS x_min FROM mv_base_a;
ERROR:  system column is not supported on incrementally maintainable materialized view
-- contain subquery
CREATE INCREMENTAL MATERIALIZED VIEW  mv_ivm03 AS SELECT i,j FROM mv_base_a WHERE i IN (SELECT i FROM mv_base_b WHERE k < 103 );
ERROR:  subquery is not supported on incrementally maintainable materialized view
CREATE INCREMENTAL MATERIALIZED VIEW  mv_ivm04 AS SELECT a.i,a.j FROM mv_base_a a, (SELECT * FROM mv_base_b) b WHERE a.i = b.i;
ERROR:  subquery is not supported on incrementally maintainable materialized view
CREATE INCREMENTAL MATERIALIZED VIEW  mv_ivm05 AS SELECT i,j, (SELECT k FROM mv_base_b b WHERE a.i = b.i) FROM mv_base_a a;
ERROR:  subquery is not supported on incrementally maintainable materialized view
-- contain ORDER BY
CREATE INCREMENTAL MATERIALIZED VIEW mv_ivm07 AS SELECT i,j,k FROM mv_base_a a INNER JOIN mv_base_b b USING(i) ORDER BY i,j,k;
ERROR:  ORDER BY clause is not supported on incrementally maintainable materialized view
-- contain HAVING
CREATE INCREMENTAL MATERIALIZED VIEW mv_ivm08 AS SELECT i,j,k FROM mv_base_a a INNER JOIN mv_base_b b USING(i) GROUP BY i,j,k HAVING SUM(i) > 5;
ERROR:   HAVING clause is not supported on incrementally maintainable materialized view
-- contain view or materialized view
CREATE VIEW b_view AS SELECT i,k FROM mv_base_b;
CREATE MATERIALIZED VIEW b_mview AS SELECT i,k FROM mv_base_b;
CREATE INCREMENTAL MATERIALIZED VIEW  mv_ivm07 AS SELECT a.i,a.j FROM mv_base_a a,b_view b WHERE a.i = b.i;
ERROR:  VIEW or MATERIALIZED VIEW is not supported on incrementally maintainable materialized view
CREATE INCREMENTAL MATERIALIZED VIEW  mv_ivm08 AS SELECT a.i,a.j FROM mv_base_a a,b_mview b WHERE a.i = b.i;
ERROR:  VIEW or MATERIALIZED VIEW is not supported on incrementally maintainable materialized view
CREATE INCREMENTAL MATERIALIZED VIEW  mv_ivm09 AS SELECT a.i,a.j FROM mv_base_a a, (SELECT i, COUNT(*) FROM mv_base_b GROUP BY i) b WHERE a.i = b.i;
ERROR:  subquery is not supported on incrementally maintainable materialized view
CREATE INCREMENTAL MATERIALIZED VIEW  mv_ivm10 AS SELECT a.i,a.j FROM mv_base_a a WHERE EXISTS(SELECT 1 FROM mv_base_b b WHERE a.i = b.i) OR a.i > 5;
ERROR:  subquery is not supported on incrementally maintainable materialized view
-- contain mutable functions
CREATE INCREMENTAL MATERIALIZED VIEW  mv_ivm12 AS SELECT i,j FROM mv_base_a WHERE i = random()::int;
ERROR:  mutable function is not supported on incrementally maintainable materialized view
HINT:  functions must be marked IMMUTABLE
-- LIMIT/OFFSET is not supported
CREATE INCREMENTAL MATERIALIZED VIEW  mv_ivm13 AS SELECT i,j FROM mv_base_a LIMIT 10 OFFSET 5;
ERROR:  LIMIT/OFFSET clause is not supported on incrementally maintainable materialized view
-- DISTINCT ON is not supported
CREATE INCREMENTAL MATERIALIZED VIEW  mv_ivm14 AS SELECT DISTINCT ON(i) i, j FROM mv_base_a;
ERROR:  DISTINCT is not supported on incrementally maintainable materialized view
-- TABLESAMPLE clause is not supported
CREATE INCREMENTAL MATERIALIZED VIEW  mv_ivm15 AS SELECT i, j FROM mv_base_a TABLESAMPLE SYSTEM(50);
ERROR:  TABLESAMPLE clause is not supported on incrementally maintainable materialized view
-- window functions are not supported
CREATE INCREMENTAL MATERIALIZED VIEW  mv_ivm16 AS SELECT *, cume_dist() OVER (ORDER BY i) AS rank FROM mv_base_a;
ERROR:  window functions are not supported on incrementally maintainable materialized view
-- inheritance parent is not supported
BEGIN;
CREATE TABLE parent (i int, v int);
CREATE TABLE child_a(options text) INHERITS(parent);
CREATE INCREMENTAL MATERIALIZED VIEW  mv_ivm21 AS SELECT * FROM parent;
ERROR:  inheritance parent is not supported on incrementally maintainable materialized view
ROLLBACK;
-- UNION statement is not supported
CREATE INCREMENTAL MATERIALIZED VIEW  mv_ivm22 AS SELECT i,j FROM mv_base_a UNION ALL SELECT i,k FROM mv_base_b;;
ERROR:  UNION/INTERSECT/EXCEPT statements are not supported on incrementally maintainable materialized view
-- empty target list is not allowed with IVM
CREATE INCREMENTAL MATERIALIZED VIEW  mv_ivm25 AS SELECT FROM mv_base_a;
ERROR:  empty target list is not supported on incrementally maintainable materialized view
-- FOR UPDATE/SHARE is not supported
CREATE INCREMENTAL MATERIALIZED VIEW  mv_ivm26 AS SELECT i,j FROM mv_base_a FOR UPDATE;
ERROR:  FOR UPDATE/SHARE clause is not supported on incrementally maintainable materialized view
-- tartget list cannot contain ivm column that start with '__ivm'
CREATE INCREMENTAL MATERIALIZED VIEW  mv_ivm28 AS SELECT i AS "__ivm_count__" FROM mv_base_a;
ERROR:  column name __ivm_count__ is not supported on incrementally maintainable materialized view
-- expressions specified in GROUP BY must appear in the target list.
CREATE INCREMENTAL MATERIALIZED VIEW  mv_ivm29 AS SELECT COUNT(i) FROM mv_base_a GROUP BY i;
ERROR:  aggregate function is not supported on incrementally maintainable materialized view
-- VALUES is not supported
CREATE INCREMENTAL MATERIALIZED VIEW mv_ivm_only_values1 AS values(1);
ERROR:  VALUES is not supported on incrementally maintainable materialized view
-- views containing base tables with Row Level Security
DROP USER IF EXISTS regress_ivm_admin;
NOTICE:  role "regress_ivm_admin" does not exist, skipping
DROP USER IF EXISTS regress_ivm_user;
NOTICE:  role "regress_ivm_user" does not exist, skipping
CREATE USER regress_ivm_admin;
CREATE USER regress_ivm_user;
--- create a table with RLS
SET SESSION AUTHORIZATION regress_ivm_admin;
CREATE TABLE rls_tbl(id int, data text, owner name);
INSERT INTO rls_tbl VALUES
  (1,'foo','regress_ivm_user'),
  (2,'bar','postgres');
CREATE TABLE num_tbl(id int, num text);
INSERT INTO num_tbl VALUES
  (1,'one'),
  (2,'two'),
  (3,'three'),
  (4,'four'),
  (5,'five'),
  (6,'six');
--- Users can access only their own rows
CREATE POLICY rls_tbl_policy ON rls_tbl FOR SELECT TO PUBLIC USING(owner = current_user);
ALTER TABLE rls_tbl ENABLE ROW LEVEL SECURITY;
GRANT ALL on rls_tbl TO PUBLIC;
GRANT ALL on num_tbl TO PUBLIC;
--- create a view owned by regress_ivm_user
SET SESSION AUTHORIZATION regress_ivm_user;
CREATE INCREMENTAL MATERIALIZED VIEW  ivm_rls AS SELECT * FROM rls_tbl;
NOTICE:  could not create an index on materialized view "ivm_rls" automatically
DETAIL:  This target list does not have all the primary key columns. 
HINT:  Create an index on the materialized view for efficient incremental maintenance.
SELECT id, data, owner FROM ivm_rls ORDER BY 1,2,3;
 id | data |      owner       
----+------+------------------
  1 | foo  | regress_ivm_user
(1 row)

RESET SESSION AUTHORIZATION;
--- inserts rows owned by different users
INSERT INTO rls_tbl VALUES
  (3,'baz','regress_ivm_user'),
  (4,'qux','postgres');
SELECT id, data, owner FROM ivm_rls ORDER BY 1,2,3;
 id | data |      owner       
----+------+------------------
  1 | foo  | regress_ivm_user
  3 | baz  | regress_ivm_user
(2 rows)

--- combination of diffent kinds of commands
WITH
 i AS (INSERT INTO rls_tbl VALUES(5,'quux','postgres'), (6,'corge','regress_ivm_user')),
 u AS (UPDATE rls_tbl SET owner = 'postgres' WHERE id = 1),
 u2 AS (UPDATE rls_tbl SET owner = 'regress_ivm_user' WHERE id = 2)
SELECT;
--
(1 row)

SELECT id, data, owner FROM ivm_rls ORDER BY 1,2,3;
 id | data  |      owner       
----+-------+------------------
  2 | bar   | regress_ivm_user
  3 | baz   | regress_ivm_user
  6 | corge | regress_ivm_user
(3 rows)

---
SET SESSION AUTHORIZATION regress_ivm_user;
CREATE INCREMENTAL MATERIALIZED VIEW ivm_rls2 AS SELECT * FROM rls_tbl JOIN num_tbl USING(id);
NOTICE:  could not create an index on materialized view "ivm_rls2" automatically
DETAIL:  This target list does not have all the primary key columns. 
HINT:  Create an index on the materialized view for efficient incremental maintenance.
RESET SESSION AUTHORIZATION;
WITH
 x AS (UPDATE rls_tbl SET data = data || '_2' where id in (3,4)),
 y AS (UPDATE num_tbl SET num = num || '_2' where id in (3,4))
SELECT;
--
(1 row)

SELECT * FROM ivm_rls2 ORDER BY 1,2,3;
 id | data  |      owner       |   num   
----+-------+------------------+---------
  2 | bar   | regress_ivm_user | two
  3 | baz_2 | regress_ivm_user | three_2
  6 | corge | regress_ivm_user | six
(3 rows)

-- trigger updating the same table
BEGIN;
CREATE TABLE tbl_update_same (i int);
CREATE FUNCTION func_update_same() RETURNS TRIGGER AS
 $$ BEGIN UPDATE tbl_update_same SET i = i + 1; RETURN NEW; END; $$
 LANGUAGE plpgsql;
CREATE TRIGGER trig_update_same AFTER INSERT ON tbl_update_same FOR EACH ROW
 EXECUTE FUNCTION func_update_same();
CREATE INCREMENTAL MATERIALIZED VIEW mv_update_same AS SELECT * FROM tbl_update_same;
NOTICE:  could not create an index on materialized view "mv_update_same" automatically
DETAIL:  This target list does not have all the primary key columns. 
HINT:  Create an index on the materialized view for efficient incremental maintenance.
INSERT INTO tbl_update_same VALUES (1);
SELECT * FROM mv_update_same;
 i 
---
 2
(1 row)

-- self-referential FKs
CREATE TABLE tbl_self_ref (a int primary key,
						   b int references tbl_self_ref(a) ON UPDATE CASCADE);
INSERT INTO tbl_self_ref VALUES (1, null), (2, 1), (3, 2);
CREATE INCREMENTAL MATERIALIZED VIEW mv_self_ref AS SELECT * FROM tbl_self_ref;
NOTICE:  created index "mv_self_ref_index" on materialized view "mv_self_ref"
UPDATE tbl_self_ref set a = a + 10;
SELECT * FROM mv_self_ref ORDER BY a;
 a  | b  
----+----
 11 |   
 12 | 11
 13 | 12
(3 rows)

ROLLBACK;
-- automatic index creation
BEGIN;
CREATE TABLE base_a (i int primary key, j int);
CREATE TABLE base_b (i int primary key, j int);
--- with all pkey columns: create an index
CREATE INCREMENTAL MATERIALIZED VIEW mv_idx3(i_a, i_b) AS SELECT a.i, b.i FROM base_a a, base_b b;
NOTICE:  created index "mv_idx3_index" on materialized view "mv_idx3"
--- missing some pkey columns: no index
CREATE INCREMENTAL MATERIALIZED VIEW mv_idx4 AS SELECT j FROM base_a;
NOTICE:  could not create an index on materialized view "mv_idx4" automatically
DETAIL:  This target list does not have all the primary key columns. 
HINT:  Create an index on the materialized view for efficient incremental maintenance.
CREATE INCREMENTAL MATERIALIZED VIEW mv_idx5 AS SELECT a.i, b.j FROM base_a a, base_b b;
NOTICE:  could not create an index on materialized view "mv_idx5" automatically
DETAIL:  This target list does not have all the primary key columns. 
HINT:  Create an index on the materialized view for efficient incremental maintenance.
--- with set-returning function: no index
CREATE INCREMENTAL MATERIALIZED VIEW mv_idx6 AS SELECT i FROM base_a, generate_series(1,10);
NOTICE:  could not create an index on materialized view "mv_idx6" automatically
DETAIL:  This target list does not have all the primary key columns. 
HINT:  Create an index on the materialized view for efficient incremental maintenance.
ROLLBACK;
-- type that doesn't have default operator class for access method btree
BEGIN;
CREATE TABLE table_json (j json);
CREATE INCREMENTAL MATERIALIZED VIEW mv_json AS SELECT * from table_json;
ERROR:  data type json has no default operator class for access method "btree"
ROLLBACK;
-- cleanup
DROP TABLE rls_tbl CASCADE;
NOTICE:  drop cascades to 2 other objects
DETAIL:  drop cascades to materialized view ivm_rls
drop cascades to materialized view ivm_rls2
DROP TABLE num_tbl CASCADE;
DROP USER regress_ivm_user;
DROP USER regress_ivm_admin;
DROP TABLE mv_base_b CASCADE;
NOTICE:  drop cascades to 3 other objects
DETAIL:  drop cascades to materialized view mv_ivm_1
drop cascades to view b_view
drop cascades to materialized view b_mview
DROP TABLE mv_base_a CASCADE;
