--
-- SELECT_DISTINCT
--
--
-- awk '{print $3;}' onek.data | sort -n | uniq
--
SELECT DISTINCT two FROM tmp ORDER BY 1;
 two 
-----
   0
   1
(2 rows)

--
-- awk '{print $5;}' onek.data | sort -n | uniq
--
SELECT DISTINCT ten FROM tmp ORDER BY 1;
 ten 
-----
   0
   1
   2
   3
   4
   5
   6
   7
   8
   9
(10 rows)

--
-- awk '{print $16;}' onek.data | sort -d | uniq
--
SELECT DISTINCT string4 FROM tmp ORDER BY 1;
 string4 
---------
 AAAAxx
 HHHHxx
 OOOOxx
 VVVVxx
(4 rows)

--
-- awk '{print $3,$16,$5;}' onek.data | sort -d | uniq |
-- sort +0n -1 +1d -2 +2n -3
--
SELECT DISTINCT two, string4, ten
   FROM tmp
   ORDER BY two using <, string4 using <, ten using <;
 two | string4 | ten 
-----+---------+-----
   0 | AAAAxx  |   0
   0 | AAAAxx  |   2
   0 | AAAAxx  |   4
   0 | AAAAxx  |   6
   0 | AAAAxx  |   8
   0 | HHHHxx  |   0
   0 | HHHHxx  |   2
   0 | HHHHxx  |   4
   0 | HHHHxx  |   6
   0 | HHHHxx  |   8
   0 | OOOOxx  |   0
   0 | OOOOxx  |   2
   0 | OOOOxx  |   4
   0 | OOOOxx  |   6
   0 | OOOOxx  |   8
   0 | VVVVxx  |   0
   0 | VVVVxx  |   2
   0 | VVVVxx  |   4
   0 | VVVVxx  |   6
   0 | VVVVxx  |   8
   1 | AAAAxx  |   1
   1 | AAAAxx  |   3
   1 | AAAAxx  |   5
   1 | AAAAxx  |   7
   1 | AAAAxx  |   9
   1 | HHHHxx  |   1
   1 | HHHHxx  |   3
   1 | HHHHxx  |   5
   1 | HHHHxx  |   7
   1 | HHHHxx  |   9
   1 | OOOOxx  |   1
   1 | OOOOxx  |   3
   1 | OOOOxx  |   5
   1 | OOOOxx  |   7
   1 | OOOOxx  |   9
   1 | VVVVxx  |   1
   1 | VVVVxx  |   3
   1 | VVVVxx  |   5
   1 | VVVVxx  |   7
   1 | VVVVxx  |   9
(40 rows)

--
-- awk '{print $2;}' person.data |
-- awk '{if(NF!=1){print $2;}else{print;}}' - emp.data |
-- awk '{if(NF!=1){print $2;}else{print;}}' - student.data |
-- awk 'BEGIN{FS="      ";}{if(NF!=1){print $5;}else{print;}}' - stud_emp.data |
-- sort -n -r | uniq
--
SELECT DISTINCT p.age FROM person* p ORDER BY age using >;
 age 
-----
  98
  88
  78
  68
  60
  58
  50
  48
  40
  38
  34
  30
  28
  25
  24
  23
  20
  19
  18
   8
(20 rows)

--
-- Check mentioning same column more than once
--
EXPLAIN (VERBOSE, COSTS OFF)
SELECT count(*) FROM
  (SELECT DISTINCT two, four, two FROM tenk1) ss;
                       QUERY PLAN                       
--------------------------------------------------------
 Aggregate
   Output: count(*)
   ->  HashAggregate
         Output: tenk1.two, tenk1.four, tenk1.two
         Group Key: tenk1.two, tenk1.four, tenk1.two
         ->  Seq Scan on public.tenk1
               Output: tenk1.two, tenk1.four, tenk1.two
(7 rows)

SELECT count(*) FROM
  (SELECT DISTINCT two, four, two FROM tenk1) ss;
 count 
-------
     4
(1 row)

--
-- Compare results between plans using sorting and plans using hash
-- aggregation. Force spilling in both cases by setting work_mem low.
--
SET work_mem='64kB';
-- Produce results with sorting.
SET enable_hashagg=FALSE;
SET jit_above_cost=0;
EXPLAIN (costs off)
SELECT DISTINCT g%1000 FROM generate_series(0,9999) g;
                   QUERY PLAN                   
------------------------------------------------
 Unique
   ->  Sort
         Sort Key: ((g % 1000))
         ->  Function Scan on generate_series g
(4 rows)

CREATE TABLE distinct_group_1 AS
SELECT DISTINCT g%1000 FROM generate_series(0,9999) g;
SET jit_above_cost TO DEFAULT;
CREATE TABLE distinct_group_2 AS
SELECT DISTINCT (g%1000)::text FROM generate_series(0,9999) g;
SET enable_hashagg=TRUE;
-- Produce results with hash aggregation.
SET enable_sort=FALSE;
SET jit_above_cost=0;
EXPLAIN (costs off)
SELECT DISTINCT g%1000 FROM generate_series(0,9999) g;
                QUERY PLAN                
------------------------------------------
 HashAggregate
   Group Key: (g % 1000)
   ->  Function Scan on generate_series g
(3 rows)

CREATE TABLE distinct_hash_1 AS
SELECT DISTINCT g%1000 FROM generate_series(0,9999) g;
SET jit_above_cost TO DEFAULT;
CREATE TABLE distinct_hash_2 AS
SELECT DISTINCT (g%1000)::text FROM generate_series(0,9999) g;
SET enable_sort=TRUE;
SET work_mem TO DEFAULT;
-- Compare results
(SELECT * FROM distinct_hash_1 EXCEPT SELECT * FROM distinct_group_1)
  UNION ALL
(SELECT * FROM distinct_group_1 EXCEPT SELECT * FROM distinct_hash_1);
 ?column? 
----------
(0 rows)

(SELECT * FROM distinct_hash_1 EXCEPT SELECT * FROM distinct_group_1)
  UNION ALL
(SELECT * FROM distinct_group_1 EXCEPT SELECT * FROM distinct_hash_1);
 ?column? 
----------
(0 rows)

DROP TABLE distinct_hash_1;
DROP TABLE distinct_hash_2;
DROP TABLE distinct_group_1;
DROP TABLE distinct_group_2;
--
-- Also, some tests of IS DISTINCT FROM, which doesn't quite deserve its
-- very own regression file.
--
CREATE TEMP TABLE disttable (f1 integer);
INSERT INTO DISTTABLE VALUES(1);
INSERT INTO DISTTABLE VALUES(2);
INSERT INTO DISTTABLE VALUES(3);
INSERT INTO DISTTABLE VALUES(NULL);
-- basic cases
SELECT f1, f1 IS DISTINCT FROM 2 as "not 2" FROM disttable;
 f1 | not 2 
----+-------
  1 | t
  2 | f
  3 | t
    | t
(4 rows)

SELECT f1, f1 IS DISTINCT FROM NULL as "not null" FROM disttable;
 f1 | not null 
----+----------
  1 | t
  2 | t
  3 | t
    | f
(4 rows)

SELECT f1, f1 IS DISTINCT FROM f1 as "false" FROM disttable;
 f1 | false 
----+-------
  1 | f
  2 | f
  3 | f
    | f
(4 rows)

SELECT f1, f1 IS DISTINCT FROM f1+1 as "not null" FROM disttable;
 f1 | not null 
----+----------
  1 | t
  2 | t
  3 | t
    | f
(4 rows)

-- check that optimizer constant-folds it properly
SELECT 1 IS DISTINCT FROM 2 as "yes";
 yes 
-----
 t
(1 row)

SELECT 2 IS DISTINCT FROM 2 as "no";
 no 
----
 f
(1 row)

SELECT 2 IS DISTINCT FROM null as "yes";
 yes 
-----
 t
(1 row)

SELECT null IS DISTINCT FROM null as "no";
 no 
----
 f
(1 row)

-- negated form
SELECT 1 IS NOT DISTINCT FROM 2 as "no";
 no 
----
 f
(1 row)

SELECT 2 IS NOT DISTINCT FROM 2 as "yes";
 yes 
-----
 t
(1 row)

SELECT 2 IS NOT DISTINCT FROM null as "no";
 no 
----
 f
(1 row)

SELECT null IS NOT DISTINCT FROM null as "yes";
 yes 
-----
 t
(1 row)

-- index only skip scan
CREATE TABLE distinct_a (a int, b int, c int);
INSERT INTO distinct_a (
    SELECT five, tenthous, 10 FROM
    generate_series(1, 5) five,
    generate_series(1, 10000) tenthous
);
CREATE INDEX ON distinct_a (a, b);
CREATE INDEX ON distinct_a ((a + 1));
ANALYZE distinct_a;
SELECT DISTINCT a FROM distinct_a;
 a 
---
 1
 2
 3
 4
 5
(5 rows)

SELECT DISTINCT a FROM distinct_a WHERE a = 1;
 a 
---
 1
(1 row)

SELECT DISTINCT a FROM distinct_a ORDER BY a DESC;
 a 
---
 5
 4
 3
 2
 1
(5 rows)

EXPLAIN (COSTS OFF)
SELECT DISTINCT a FROM distinct_a;
                       QUERY PLAN                       
--------------------------------------------------------
 Index Only Scan using distinct_a_a_b_idx on distinct_a
   Skip scan: true
(2 rows)

-- test index skip scan with a condition on a non unique field
SELECT DISTINCT ON (a) a, b FROM distinct_a WHERE b = 2;
 a | b 
---+---
 1 | 2
 2 | 2
 3 | 2
 4 | 2
 5 | 2
(5 rows)

-- test index skip scan backwards
SELECT DISTINCT ON (a) a, b FROM distinct_a ORDER BY a DESC, b DESC;
 a |   b   
---+-------
 5 | 10000
 4 | 10000
 3 | 10000
 2 | 10000
 1 | 10000
(5 rows)

-- test index skip scan for expressions
EXPLAIN (COSTS OFF)
SELECT DISTINCT (a + 1) FROM distinct_a;
                     QUERY PLAN                     
----------------------------------------------------
 Index Scan using distinct_a_expr_idx on distinct_a
   Skip scan: true
(2 rows)

SELECT DISTINCT (a + 1) FROM distinct_a;
 ?column? 
----------
        2
        3
        4
        5
        6
(5 rows)

-- check colums order
CREATE INDEX distinct_a_b_a on distinct_a (b, a);
SELECT DISTINCT a FROM distinct_a WHERE b = 2;
 a 
---
 1
 2
 3
 4
 5
(5 rows)

SELECT DISTINCT on (a, b) a, b FROM distinct_a WHERE b = 2;
 a | b 
---+---
 1 | 2
 2 | 2
 3 | 2
 4 | 2
 5 | 2
(5 rows)

EXPLAIN (COSTS OFF)
SELECT DISTINCT a FROM distinct_a WHERE b = 2;
                     QUERY PLAN                     
----------------------------------------------------
 Index Only Scan using distinct_a_b_a on distinct_a
   Skip scan: true
   Index Cond: (b = 2)
(3 rows)

EXPLAIN (COSTS OFF)
SELECT DISTINCT on (a, b) a, b FROM distinct_a WHERE b = 2;
                     QUERY PLAN                     
----------------------------------------------------
 Index Only Scan using distinct_a_b_a on distinct_a
   Skip scan: true
   Index Cond: (b = 2)
(3 rows)

DROP INDEX distinct_a_b_a;
-- test opposite scan/index directions inside a cursor
-- forward/backward
BEGIN;
DECLARE c SCROLL CURSOR FOR
SELECT DISTINCT ON (a) a,b FROM distinct_a ORDER BY a, b;
FETCH FROM c;
 a | b 
---+---
 1 | 1
(1 row)

FETCH BACKWARD FROM c;
 a | b 
---+---
(0 rows)

FETCH 6 FROM c;
 a | b 
---+---
 1 | 1
 2 | 1
 3 | 1
 4 | 1
 5 | 1
(5 rows)

FETCH BACKWARD 6 FROM c;
 a | b 
---+---
 5 | 1
 4 | 1
 3 | 1
 2 | 1
 1 | 1
(5 rows)

FETCH 6 FROM c;
 a | b 
---+---
 1 | 1
 2 | 1
 3 | 1
 4 | 1
 5 | 1
(5 rows)

FETCH BACKWARD 6 FROM c;
 a | b 
---+---
 5 | 1
 4 | 1
 3 | 1
 2 | 1
 1 | 1
(5 rows)

END;
-- backward/forward
BEGIN;
DECLARE c SCROLL CURSOR FOR
SELECT DISTINCT ON (a) a,b FROM distinct_a ORDER BY a DESC, b DESC;
FETCH FROM c;
 a |   b   
---+-------
 5 | 10000
(1 row)

FETCH BACKWARD FROM c;
 a | b 
---+---
(0 rows)

FETCH 6 FROM c;
 a |   b   
---+-------
 5 | 10000
 4 | 10000
 3 | 10000
 2 | 10000
 1 | 10000
(5 rows)

FETCH BACKWARD 6 FROM c;
 a |   b   
---+-------
 1 | 10000
 2 | 10000
 3 | 10000
 4 | 10000
 5 | 10000
(5 rows)

FETCH 6 FROM c;
 a |   b   
---+-------
 5 | 10000
 4 | 10000
 3 | 10000
 2 | 10000
 1 | 10000
(5 rows)

FETCH BACKWARD 6 FROM c;
 a |   b   
---+-------
 1 | 10000
 2 | 10000
 3 | 10000
 4 | 10000
 5 | 10000
(5 rows)

END;
-- test missing values and skipping from the end
CREATE TABLE distinct_abc(a int, b int, c int);
CREATE INDEX ON distinct_abc(a, b, c);
INSERT INTO distinct_abc
	VALUES (1, 1, 1),
		   (1, 1, 2),
		   (1, 2, 2),
		   (1, 2, 3),
		   (2, 2, 1),
		   (2, 2, 3),
		   (3, 1, 1),
		   (3, 1, 2),
		   (3, 2, 2),
		   (3, 2, 3);
EXPLAIN (COSTS OFF)
SELECT DISTINCT ON (a) a,b,c FROM distinct_abc WHERE c = 2;
                          QUERY PLAN                          
--------------------------------------------------------------
 Index Only Scan using distinct_abc_a_b_c_idx on distinct_abc
   Skip scan: true
   Index Cond: (c = 2)
(3 rows)

BEGIN;
DECLARE c SCROLL CURSOR FOR
SELECT DISTINCT ON (a) a,b,c FROM distinct_abc WHERE c = 2;
FETCH ALL FROM c;
 a | b | c 
---+---+---
 1 | 1 | 2
 3 | 1 | 2
(2 rows)

FETCH BACKWARD ALL FROM c;
 a | b | c 
---+---+---
 3 | 1 | 2
 1 | 1 | 2
(2 rows)

END;
EXPLAIN (COSTS OFF)
SELECT DISTINCT ON (a) a,b,c FROM distinct_abc WHERE c = 2
ORDER BY a DESC, b DESC;
                              QUERY PLAN                               
-----------------------------------------------------------------------
 Index Only Scan Backward using distinct_abc_a_b_c_idx on distinct_abc
   Skip scan: true
   Index Cond: (c = 2)
(3 rows)

BEGIN;
DECLARE c SCROLL CURSOR FOR
SELECT DISTINCT ON (a) a,b,c FROM distinct_abc WHERE c = 2
ORDER BY a DESC, b DESC;
FETCH ALL FROM c;
 a | b | c 
---+---+---
 3 | 2 | 2
 1 | 2 | 2
(2 rows)

FETCH BACKWARD ALL FROM c;
 a | b | c 
---+---+---
 1 | 2 | 2
 3 | 2 | 2
(2 rows)

END;
DROP TABLE distinct_abc;
-- index skip scan
SELECT DISTINCT ON (a) a, b, c
FROM distinct_a ORDER BY a;
 a | b | c  
---+---+----
 1 | 1 | 10
 2 | 1 | 10
 3 | 1 | 10
 4 | 1 | 10
 5 | 1 | 10
(5 rows)

SELECT DISTINCT ON (a) a, b, c
FROM distinct_a WHERE a = 1 ORDER BY a;
 a | b | c  
---+---+----
 1 | 1 | 10
(1 row)

EXPLAIN (COSTS OFF)
SELECT DISTINCT ON (a) a, b, c
FROM distinct_a ORDER BY a;
                    QUERY PLAN                     
---------------------------------------------------
 Index Scan using distinct_a_a_b_idx on distinct_a
   Skip scan: true
(2 rows)

EXPLAIN (COSTS OFF)
SELECT DISTINCT ON (a) a, b, c
FROM distinct_a WHERE a = 1 ORDER BY a;
                    QUERY PLAN                     
---------------------------------------------------
 Index Scan using distinct_a_a_b_idx on distinct_a
   Skip scan: true
   Index Cond: (a = 1)
(3 rows)

EXPLAIN (COSTS OFF)
SELECT DISTINCT *
FROM distinct_a;
          QUERY PLAN          
------------------------------
 HashAggregate
   Group Key: a, b, c
   ->  Seq Scan on distinct_a
(3 rows)

-- check colums order
SELECT DISTINCT a FROM distinct_a WHERE b = 2 AND c = 10;
 a 
---
 1
 2
 3
 4
 5
(5 rows)

EXPLAIN (COSTS OFF)
SELECT DISTINCT a FROM distinct_a WHERE b = 2 AND c = 10;
                       QUERY PLAN                        
---------------------------------------------------------
 Unique
   ->  Index Scan using distinct_a_a_b_idx on distinct_a
         Index Cond: (b = 2)
         Filter: (c = 10)
(4 rows)

-- check projection case
SELECT DISTINCT a, a FROM distinct_a WHERE b = 2;
 a | a 
---+---
 1 | 1
 2 | 2
 3 | 3
 4 | 4
 5 | 5
(5 rows)

SELECT DISTINCT a, 1 FROM distinct_a WHERE b = 2;
 a | ?column? 
---+----------
 1 |        1
 2 |        1
 3 |        1
 4 |        1
 5 |        1
(5 rows)

-- test cursor forward/backward movements
BEGIN;
DECLARE c SCROLL CURSOR FOR SELECT DISTINCT a FROM distinct_a;
FETCH FROM c;
 a 
---
 1
(1 row)

FETCH BACKWARD FROM c;
 a 
---
(0 rows)

FETCH 6 FROM c;
 a 
---
 1
 2
 3
 4
 5
(5 rows)

FETCH BACKWARD 6 FROM c;
 a 
---
 5
 4
 3
 2
 1
(5 rows)

FETCH 6 FROM c;
 a 
---
 1
 2
 3
 4
 5
(5 rows)

FETCH BACKWARD 6 FROM c;
 a 
---
 5
 4
 3
 2
 1
(5 rows)

END;
DROP TABLE distinct_a;
-- test tuples visibility
CREATE TABLE distinct_visibility (a int, b int);
INSERT INTO distinct_visibility (select a, b from generate_series(1,5) a, generate_series(1, 10000) b);
CREATE INDEX ON distinct_visibility (a, b);
ANALYZE distinct_visibility;
SELECT DISTINCT ON (a) a, b FROM distinct_visibility ORDER BY a, b;
 a | b 
---+---
 1 | 1
 2 | 1
 3 | 1
 4 | 1
 5 | 1
(5 rows)

DELETE FROM distinct_visibility WHERE a = 2 and b = 1;
SELECT DISTINCT ON (a) a, b FROM distinct_visibility ORDER BY a, b;
 a | b 
---+---
 1 | 1
 2 | 2
 3 | 1
 4 | 1
 5 | 1
(5 rows)

SELECT DISTINCT ON (a) a, b FROM distinct_visibility ORDER BY a DESC, b DESC;
 a |   b   
---+-------
 5 | 10000
 4 | 10000
 3 | 10000
 2 | 10000
 1 | 10000
(5 rows)

DELETE FROM distinct_visibility WHERE a = 2 and b = 10000;
SELECT DISTINCT ON (a) a, b FROM distinct_visibility ORDER BY a DESC, b DESC;
 a |   b   
---+-------
 5 | 10000
 4 | 10000
 3 | 10000
 2 |  9999
 1 | 10000
(5 rows)

DROP TABLE distinct_visibility;
-- test page boundaries
CREATE TABLE distinct_boundaries AS
    SELECT a, b::int2 b, (b % 2)::int2 c FROM
        generate_series(1, 5) a,
        generate_series(1,366) b;
CREATE INDEX ON distinct_boundaries (a, b, c);
ANALYZE distinct_boundaries;
EXPLAIN (COSTS OFF)
SELECT DISTINCT ON (a) a, b, c from distinct_boundaries
WHERE b >= 1 and c = 0 ORDER BY a, b;
                                 QUERY PLAN                                 
----------------------------------------------------------------------------
 Index Only Scan using distinct_boundaries_a_b_c_idx on distinct_boundaries
   Skip scan: true
   Index Cond: ((b >= 1) AND (c = 0))
(3 rows)

SELECT DISTINCT ON (a) a, b, c from distinct_boundaries
WHERE b >= 1 and c = 0 ORDER BY a, b;
 a | b | c 
---+---+---
 1 | 2 | 0
 2 | 2 | 0
 3 | 2 | 0
 4 | 2 | 0
 5 | 2 | 0
(5 rows)

DROP TABLE distinct_boundaries;
-- test tuple killing
-- DESC ordering
CREATE TABLE distinct_killed AS
    SELECT a, b, b % 2 AS c, 10 AS d
        FROM generate_series(1, 5) a,
             generate_series(1,1000) b;
CREATE INDEX ON distinct_killed (a, b, c, d);
DELETE FROM distinct_killed where a = 3;
BEGIN;
    DECLARE c SCROLL CURSOR FOR
    SELECT DISTINCT ON (a) a,b,c,d
    FROM distinct_killed ORDER BY a DESC, b DESC;
    FETCH FORWARD ALL FROM c;
 a |  b   | c | d  
---+------+---+----
 5 | 1000 | 0 | 10
 4 | 1000 | 0 | 10
 2 | 1000 | 0 | 10
 1 | 1000 | 0 | 10
(4 rows)

    FETCH BACKWARD ALL FROM c;
 a |  b   | c | d  
---+------+---+----
 1 | 1000 | 0 | 10
 2 | 1000 | 0 | 10
 4 | 1000 | 0 | 10
 5 | 1000 | 0 | 10
(4 rows)

COMMIT;
DROP TABLE distinct_killed;
-- regular ordering
CREATE TABLE distinct_killed AS
    SELECT a, b, b % 2 AS c, 10 AS d
        FROM generate_series(1, 5) a,
             generate_series(1,1000) b;
CREATE INDEX ON distinct_killed (a, b, c, d);
DELETE FROM distinct_killed where a = 3;
BEGIN;
    DECLARE c SCROLL CURSOR FOR
    SELECT DISTINCT ON (a) a,b,c,d
    FROM distinct_killed ORDER BY a, b;
    FETCH FORWARD ALL FROM c;
 a | b | c | d  
---+---+---+----
 1 | 1 | 1 | 10
 2 | 1 | 1 | 10
 4 | 1 | 1 | 10
 5 | 1 | 1 | 10
(4 rows)

    FETCH BACKWARD ALL FROM c;
 a | b | c | d  
---+---+---+----
 5 | 1 | 1 | 10
 4 | 1 | 1 | 10
 2 | 1 | 1 | 10
 1 | 1 | 1 | 10
(4 rows)

COMMIT;
DROP TABLE distinct_killed;
-- partial delete
CREATE TABLE distinct_killed AS
    SELECT a, b, b % 2 AS c, 10 AS d
        FROM generate_series(1, 5) a,
             generate_series(1,1000) b;
CREATE INDEX ON distinct_killed (a, b, c, d);
DELETE FROM distinct_killed WHERE a = 3 AND b <= 999;
BEGIN;
    DECLARE c SCROLL CURSOR FOR
    SELECT DISTINCT ON (a) a,b,c,d
    FROM distinct_killed ORDER BY a DESC, b DESC;
    FETCH FORWARD ALL FROM c;
 a |  b   | c | d  
---+------+---+----
 5 | 1000 | 0 | 10
 4 | 1000 | 0 | 10
 3 | 1000 | 0 | 10
 2 | 1000 | 0 | 10
 1 | 1000 | 0 | 10
(5 rows)

    FETCH BACKWARD ALL FROM c;
 a |  b   | c | d  
---+------+---+----
 1 | 1000 | 0 | 10
 2 | 1000 | 0 | 10
 3 | 1000 | 0 | 10
 4 | 1000 | 0 | 10
 5 | 1000 | 0 | 10
(5 rows)

COMMIT;
DROP TABLE distinct_killed;
-- test posting lists
CREATE TABLE distinct_posting (a int, b int, c int);
CREATE INDEX ON distinct_posting (a, b, c);
INSERT INTO distinct_posting
	VALUES (1, 1, 1),
		   (1, 1, 2),
		   (1, 2, 2),
		   (1, 2, 3),
		   (2, 2, 1),
		   (2, 2, 3),
		   (3, 1, 1),
		   (3, 1, 2),
		   (3, 2, 2),
		   (3, 2, 3);
INSERT INTO distinct_posting (
    SELECT 1 as a, 1 as b, 1 AS c
        FROM generate_series(1,1000) i
);
BEGIN;
    DECLARE c SCROLL CURSOR FOR
    SELECT DISTINCT ON (a) a,b,c FROM distinct_posting WHERE c = 2
    ORDER BY a DESC, b DESC;
    FETCH ALL FROM c;
 a | b | c 
---+---+---
 3 | 2 | 2
 1 | 2 | 2
(2 rows)

    FETCH BACKWARD ALL FROM c;
 a | b | c 
---+---+---
 1 | 2 | 2
 3 | 2 | 2
(2 rows)

COMMIT;
